[I 2022-10-23 23:29:09,129] Trial 341 finished with value: 0.3757565391314363 and parameters: {'algorithm': 'ball_tree', 'k_n_neighbors': 10}. Best is trial 134 with value: 0.3757565391314363.
[I 2022-10-23 23:29:31,031] Trial 342 finished with value: 0.3757565391314363 and parameters: {'algorithm': 'ball_tree', 'k_n_neighbors': 10}. Best is trial 134 with value: 0.3757565391314363.
[I 2022-10-23 23:29:54,701] Trial 343 finished with value: 0.3757565391314363 and parameters: {'algorithm': 'ball_tree', 'k_n_neighbors': 10}. Best is trial 134 with value: 0.3757565391314363.
[I 2022-10-23 23:30:16,274] Trial 344 finished with value: 0.3738958658531738 and parameters: {'algorithm': 'ball_tree', 'k_n_neighbors': 9}. Best is trial 134 with value: 0.3757565391314363.
[I 2022-10-23 23:30:39,378] Trial 345 finished with value: 0.3757565391314363 and parameters: {'algorithm': 'ball_tree', 'k_n_neighbors': 10}. Best is trial 134 with value: 0.3757565391314363.
[I 2022-10-23 23:31:01,976] Trial 346 finished with value: 0.3757565391314363 and parameters: {'algorithm': 'ball_tree', 'k_n_neighbors': 10}. Best is trial 134 with value: 0.3757565391314363.
[I 2022-10-23 23:31:40,220] Trial 347 finished with value: 0.375718496832209 and parameters: {'algorithm': 'brute', 'k_n_neighbors': 10}. Best is trial 134 with value: 0.3757565391314363.
[I 2022-10-23 23:32:02,203] Trial 348 finished with value: 0.3738958658531738 and parameters: {'algorithm': 'ball_tree', 'k_n_neighbors': 9}. Best is trial 134 with value: 0.3757565391314363.
[I 2022-10-23 23:32:26,199] Trial 349 finished with value: 0.3757565391314363 and parameters: {'algorithm': 'ball_tree', 'k_n_neighbors': 10}. Best is trial 134 with value: 0.3757565391314363.
[I 2022-10-23 23:32:50,362] Trial 350 finished with value: 0.3757565391314363 and parameters: {'algorithm': 'ball_tree', 'k_n_neighbors': 10}. Best is trial 134 with value: 0.3757565391314363.
[I 2022-10-23 23:33:12,655] Trial 351 finished with value: 0.3738958658531738 and parameters: {'algorithm': 'ball_tree', 'k_n_neighbors': 9}. Best is trial 134 with value: 0.3757565391314363.
[I 2022-10-23 23:33:34,893] Trial 352 finished with value: 0.3757565391314363 and parameters: {'algorithm': 'ball_tree', 'k_n_neighbors': 10}. Best is trial 134 with value: 0.3757565391314363.
[I 2022-10-23 23:33:57,359] Trial 353 finished with value: 0.3757565391314363 and parameters: {'algorithm': 'ball_tree', 'k_n_neighbors': 10}. Best is trial 134 with value: 0.3757565391314363.
[I 2022-10-23 23:34:19,547] Trial 354 finished with value: 0.3757565391314363 and parameters: {'algorithm': 'ball_tree', 'k_n_neighbors': 10}. Best is trial 134 with value: 0.3757565391314363.
[I 2022-10-23 23:34:41,045] Trial 355 finished with value: 0.3738958658531738 and parameters: {'algorithm': 'ball_tree', 'k_n_neighbors': 9}. Best is trial 134 with value: 0.3757565391314363.
[I 2022-10-23 23:35:02,969] Trial 356 finished with value: 0.3757565391314363 and parameters: {'algorithm': 'ball_tree', 'k_n_neighbors': 10}. Best is trial 134 with value: 0.3757565391314363.
[I 2022-10-23 23:35:24,905] Trial 357 finished with value: 0.3757565391314363 and parameters: {'algorithm': 'ball_tree', 'k_n_neighbors': 10}. Best is trial 134 with value: 0.3757565391314363.
[I 2022-10-23 23:35:46,816] Trial 358 finished with value: 0.3757565391314363 and parameters: {'algorithm': 'ball_tree', 'k_n_neighbors': 10}. Best is trial 134 with value: 0.3757565391314363.
[I 2022-10-23 23:36:08,928] Trial 359 finished with value: 0.3738958658531738 and parameters: {'algorithm': 'ball_tree', 'k_n_neighbors': 9}. Best is trial 134 with value: 0.3757565391314363.
[I 2022-10-23 23:36:30,939] Trial 360 finished with value: 0.3757565391314363 and parameters: {'algorithm': 'ball_tree', 'k_n_neighbors': 10}. Best is trial 134 with value: 0.3757565391314363.
[I 2022-10-23 23:36:52,675] Trial 361 finished with value: 0.3757565391314363 and parameters: {'algorithm': 'ball_tree', 'k_n_neighbors': 10}. Best is trial 134 with value: 0.3757565391314363.
[I 2022-10-23 23:37:14,445] Trial 362 finished with value: 0.3757565391314363 and parameters: {'algorithm': 'ball_tree', 'k_n_neighbors': 10}. Best is trial 134 with value: 0.3757565391314363.
[I 2022-10-23 23:37:36,479] Trial 363 finished with value: 0.3757565391314363 and parameters: {'algorithm': 'ball_tree', 'k_n_neighbors': 10}. Best is trial 134 with value: 0.3757565391314363.
[I 2022-10-23 23:37:57,806] Trial 364 finished with value: 0.3738958658531738 and parameters: {'algorithm': 'ball_tree', 'k_n_neighbors': 9}. Best is trial 134 with value: 0.3757565391314363.
[I 2022-10-23 23:38:19,728] Trial 365 finished with value: 0.3757565391314363 and parameters: {'algorithm': 'ball_tree', 'k_n_neighbors': 10}. Best is trial 134 with value: 0.3757565391314363.
[I 2022-10-23 23:38:41,762] Trial 366 finished with value: 0.3757565391314363 and parameters: {'algorithm': 'ball_tree', 'k_n_neighbors': 10}. Best is trial 134 with value: 0.3757565391314363.
[I 2022-10-23 23:39:03,289] Trial 367 finished with value: 0.3738958658531738 and parameters: {'algorithm': 'ball_tree', 'k_n_neighbors': 9}. Best is trial 134 with value: 0.3757565391314363.
[I 2022-10-23 23:39:24,989] Trial 368 finished with value: 0.3757565391314363 and parameters: {'algorithm': 'ball_tree', 'k_n_neighbors': 10}. Best is trial 134 with value: 0.3757565391314363.
[I 2022-10-23 23:39:46,879] Trial 369 finished with value: 0.3757565391314363 and parameters: {'algorithm': 'ball_tree', 'k_n_neighbors': 10}. Best is trial 134 with value: 0.3757565391314363.
[I 2022-10-23 23:40:24,428] Trial 370 finished with value: 0.375718496832209 and parameters: {'algorithm': 'brute', 'k_n_neighbors': 10}. Best is trial 134 with value: 0.3757565391314363.
[I 2022-10-23 23:40:45,958] Trial 371 finished with value: 0.3738958658531738 and parameters: {'algorithm': 'ball_tree', 'k_n_neighbors': 9}. Best is trial 134 with value: 0.3757565391314363.
[I 2022-10-23 23:41:08,110] Trial 372 finished with value: 0.3757565391314363 and parameters: {'algorithm': 'ball_tree', 'k_n_neighbors': 10}. Best is trial 134 with value: 0.3757565391314363.
[I 2022-10-23 23:41:29,705] Trial 373 finished with value: 0.3757565391314363 and parameters: {'algorithm': 'ball_tree', 'k_n_neighbors': 10}. Best is trial 134 with value: 0.3757565391314363.
[I 2022-10-23 23:41:49,663] Trial 374 finished with value: 0.3570978929605617 and parameters: {'algorithm': 'ball_tree', 'k_n_neighbors': 5}. Best is trial 134 with value: 0.3757565391314363.
[I 2022-10-23 23:42:11,618] Trial 375 finished with value: 0.3738958658531738 and parameters: {'algorithm': 'ball_tree', 'k_n_neighbors': 9}. Best is trial 134 with value: 0.3757565391314363.
[I 2022-10-23 23:42:33,433] Trial 376 finished with value: 0.3757565391314363 and parameters: {'algorithm': 'ball_tree', 'k_n_neighbors': 10}. Best is trial 134 with value: 0.3757565391314363.
[I 2022-10-23 23:42:56,002] Trial 377 finished with value: 0.3757565391314363 and parameters: {'algorithm': 'ball_tree', 'k_n_neighbors': 10}. Best is trial 134 with value: 0.3757565391314363.
[I 2022-10-23 23:43:18,107] Trial 378 finished with value: 0.3757565391314363 and parameters: {'algorithm': 'ball_tree', 'k_n_neighbors': 10}. Best is trial 134 with value: 0.3757565391314363.
[I 2022-10-23 23:43:39,904] Trial 379 finished with value: 0.3757565391314363 and parameters: {'algorithm': 'ball_tree', 'k_n_neighbors': 10}. Best is trial 134 with value: 0.3757565391314363.
[I 2022-10-23 23:44:01,629] Trial 380 finished with value: 0.3738958658531738 and parameters: {'algorithm': 'ball_tree', 'k_n_neighbors': 9}. Best is trial 134 with value: 0.3757565391314363.
[I 2022-10-23 23:44:23,729] Trial 381 finished with value: 0.3757565391314363 and parameters: {'algorithm': 'ball_tree', 'k_n_neighbors': 10}. Best is trial 134 with value: 0.3757565391314363.
[I 2022-10-23 23:44:45,612] Trial 382 finished with value: 0.3757565391314363 and parameters: {'algorithm': 'ball_tree', 'k_n_neighbors': 10}. Best is trial 134 with value: 0.3757565391314363.
[I 2022-10-23 23:45:07,509] Trial 383 finished with value: 0.3757565391314363 and parameters: {'algorithm': 'ball_tree', 'k_n_neighbors': 10}. Best is trial 134 with value: 0.3757565391314363.
[I 2022-10-23 23:45:28,357] Trial 384 finished with value: 0.36825157688919563 and parameters: {'algorithm': 'ball_tree', 'k_n_neighbors': 7}. Best is trial 134 with value: 0.3757565391314363.
[I 2022-10-23 23:45:50,277] Trial 385 finished with value: 0.3738958658531738 and parameters: {'algorithm': 'ball_tree', 'k_n_neighbors': 9}. Best is trial 134 with value: 0.3757565391314363.
[I 2022-10-23 23:46:12,240] Trial 386 finished with value: 0.3757565391314363 and parameters: {'algorithm': 'ball_tree', 'k_n_neighbors': 10}. Best is trial 134 with value: 0.3757565391314363.
[I 2022-10-23 23:46:33,946] Trial 387 finished with value: 0.3757565391314363 and parameters: {'algorithm': 'ball_tree', 'k_n_neighbors': 10}. Best is trial 134 with value: 0.3757565391314363.
[I 2022-10-23 23:46:56,810] Trial 388 finished with value: 0.3757565391314363 and parameters: {'algorithm': 'ball_tree', 'k_n_neighbors': 10}. Best is trial 134 with value: 0.3757565391314363.
[I 2022-10-23 23:47:19,063] Trial 389 finished with value: 0.3738958658531738 and parameters: {'algorithm': 'ball_tree', 'k_n_neighbors': 9}. Best is trial 134 with value: 0.3757565391314363.
[I 2022-10-23 23:47:41,654] Trial 390 finished with value: 0.3757565391314363 and parameters: {'algorithm': 'ball_tree', 'k_n_neighbors': 10}. Best is trial 134 with value: 0.3757565391314363.
[I 2022-10-23 23:48:03,571] Trial 391 finished with value: 0.3738958658531738 and parameters: {'algorithm': 'ball_tree', 'k_n_neighbors': 9}. Best is trial 134 with value: 0.3757565391314363.
[I 2022-10-23 23:48:25,372] Trial 392 finished with value: 0.3757565391314363 and parameters: {'algorithm': 'ball_tree', 'k_n_neighbors': 10}. Best is trial 134 with value: 0.3757565391314363.
[I 2022-10-23 23:49:02,836] Trial 393 finished with value: 0.375718496832209 and parameters: {'algorithm': 'brute', 'k_n_neighbors': 10}. Best is trial 134 with value: 0.3757565391314363.
[I 2022-10-23 23:49:24,260] Trial 394 finished with value: 0.3757565391314363 and parameters: {'algorithm': 'ball_tree', 'k_n_neighbors': 10}. Best is trial 134 with value: 0.3757565391314363.
[I 2022-10-23 23:49:46,585] Trial 395 finished with value: 0.3757565391314363 and parameters: {'algorithm': 'ball_tree', 'k_n_neighbors': 10}. Best is trial 134 with value: 0.3757565391314363.
[I 2022-10-23 23:50:10,110] Trial 396 finished with value: 0.3757565391314363 and parameters: {'algorithm': 'ball_tree', 'k_n_neighbors': 10}. Best is trial 134 with value: 0.3757565391314363.
[I 2022-10-23 23:50:33,038] Trial 397 finished with value: 0.3738958658531738 and parameters: {'algorithm': 'ball_tree', 'k_n_neighbors': 9}. Best is trial 134 with value: 0.3757565391314363.
[I 2022-10-23 23:50:56,277] Trial 398 finished with value: 0.3757565391314363 and parameters: {'algorithm': 'ball_tree', 'k_n_neighbors': 10}. Best is trial 134 with value: 0.3757565391314363.
[I 2022-10-23 23:51:20,772] Trial 399 finished with value: 0.3757565391314363 and parameters: {'algorithm': 'ball_tree', 'k_n_neighbors': 10}. Best is trial 134 with value: 0.3757565391314363.
[I 2022-10-23 23:51:42,661] Trial 400 finished with value: 0.3738958658531738 and parameters: {'algorithm': 'ball_tree', 'k_n_neighbors': 9}. Best is trial 134 with value: 0.3757565391314363.
[I 2022-10-23 23:52:04,802] Trial 401 finished with value: 0.3757565391314363 and parameters: {'algorithm': 'ball_tree', 'k_n_neighbors': 10}. Best is trial 134 with value: 0.3757565391314363.
[I 2022-10-23 23:52:27,734] Trial 402 finished with value: 0.3757565391314363 and parameters: {'algorithm': 'ball_tree', 'k_n_neighbors': 10}. Best is trial 134 with value: 0.3757565391314363.
[I 2022-10-23 23:52:49,596] Trial 403 finished with value: 0.3738958658531738 and parameters: {'algorithm': 'ball_tree', 'k_n_neighbors': 9}. Best is trial 134 with value: 0.3757565391314363.
[I 2022-10-23 23:53:11,607] Trial 404 finished with value: 0.3757565391314363 and parameters: {'algorithm': 'ball_tree', 'k_n_neighbors': 10}. Best is trial 134 with value: 0.3757565391314363.
[I 2022-10-23 23:53:33,685] Trial 405 finished with value: 0.3757565391314363 and parameters: {'algorithm': 'ball_tree', 'k_n_neighbors': 10}. Best is trial 134 with value: 0.3757565391314363.
[I 2022-10-23 23:53:55,605] Trial 406 finished with value: 0.3757565391314363 and parameters: {'algorithm': 'ball_tree', 'k_n_neighbors': 10}. Best is trial 134 with value: 0.3757565391314363.
[I 2022-10-23 23:54:17,288] Trial 407 finished with value: 0.3738958658531738 and parameters: {'algorithm': 'ball_tree', 'k_n_neighbors': 9}. Best is trial 134 with value: 0.3757565391314363.
[I 2022-10-23 23:54:39,246] Trial 408 finished with value: 0.3757565391314363 and parameters: {'algorithm': 'ball_tree', 'k_n_neighbors': 10}. Best is trial 134 with value: 0.3757565391314363.
[I 2022-10-23 23:55:00,945] Trial 409 finished with value: 0.3757565391314363 and parameters: {'algorithm': 'ball_tree', 'k_n_neighbors': 10}. Best is trial 134 with value: 0.3757565391314363.
[I 2022-10-23 23:55:23,212] Trial 410 finished with value: 0.3757565391314363 and parameters: {'algorithm': 'ball_tree', 'k_n_neighbors': 10}. Best is trial 134 with value: 0.3757565391314363.
[I 2022-10-23 23:55:45,217] Trial 411 finished with value: 0.3757565391314363 and parameters: {'algorithm': 'ball_tree', 'k_n_neighbors': 10}. Best is trial 134 with value: 0.3757565391314363.
[I 2022-10-23 23:56:07,462] Trial 412 finished with value: 0.3738958658531738 and parameters: {'algorithm': 'ball_tree', 'k_n_neighbors': 9}. Best is trial 134 with value: 0.3757565391314363.
[I 2022-10-23 23:56:29,061] Trial 413 finished with value: 0.3757565391314363 and parameters: {'algorithm': 'ball_tree', 'k_n_neighbors': 10}. Best is trial 134 with value: 0.3757565391314363.
[I 2022-10-23 23:56:50,526] Trial 414 finished with value: 0.3757565391314363 and parameters: {'algorithm': 'ball_tree', 'k_n_neighbors': 10}. Best is trial 134 with value: 0.3757565391314363.
[I 2022-10-23 23:57:12,226] Trial 415 finished with value: 0.3738958658531738 and parameters: {'algorithm': 'ball_tree', 'k_n_neighbors': 9}. Best is trial 134 with value: 0.3757565391314363.
[I 2022-10-23 23:57:51,355] Trial 416 finished with value: 0.375718496832209 and parameters: {'algorithm': 'brute', 'k_n_neighbors': 10}. Best is trial 134 with value: 0.3757565391314363.
[I 2022-10-23 23:58:14,765] Trial 417 finished with value: 0.3757565391314363 and parameters: {'algorithm': 'ball_tree', 'k_n_neighbors': 10}. Best is trial 134 with value: 0.3757565391314363.
[I 2022-10-23 23:58:37,934] Trial 418 finished with value: 0.3757565391314363 and parameters: {'algorithm': 'ball_tree', 'k_n_neighbors': 10}. Best is trial 134 with value: 0.3757565391314363.
[I 2022-10-23 23:58:59,423] Trial 419 finished with value: 0.3738958658531738 and parameters: {'algorithm': 'ball_tree', 'k_n_neighbors': 9}. Best is trial 134 with value: 0.3757565391314363.
[I 2022-10-23 23:59:21,652] Trial 420 finished with value: 0.3757565391314363 and parameters: {'algorithm': 'ball_tree', 'k_n_neighbors': 10}. Best is trial 134 with value: 0.3757565391314363.
[I 2022-10-23 23:59:44,285] Trial 421 finished with value: 0.3757565391314363 and parameters: {'algorithm': 'ball_tree', 'k_n_neighbors': 10}. Best is trial 134 with value: 0.3757565391314363.
[I 2022-10-24 00:00:06,940] Trial 422 finished with value: 0.3757565391314363 and parameters: {'algorithm': 'ball_tree', 'k_n_neighbors': 10}. Best is trial 134 with value: 0.3757565391314363.
[I 2022-10-24 00:00:29,895] Trial 423 finished with value: 0.3757565391314363 and parameters: {'algorithm': 'ball_tree', 'k_n_neighbors': 10}. Best is trial 134 with value: 0.3757565391314363.
[I 2022-10-24 00:00:51,644] Trial 424 finished with value: 0.3738958658531738 and parameters: {'algorithm': 'ball_tree', 'k_n_neighbors': 9}. Best is trial 134 with value: 0.3757565391314363.
[I 2022-10-24 00:01:14,506] Trial 425 finished with value: 0.3757565391314363 and parameters: {'algorithm': 'ball_tree', 'k_n_neighbors': 10}. Best is trial 134 with value: 0.3757565391314363.
[I 2022-10-24 00:01:36,387] Trial 426 finished with value: 0.3757565391314363 and parameters: {'algorithm': 'ball_tree', 'k_n_neighbors': 10}. Best is trial 134 with value: 0.3757565391314363.
[I 2022-10-24 00:01:57,824] Trial 427 finished with value: 0.3738958658531738 and parameters: {'algorithm': 'ball_tree', 'k_n_neighbors': 9}. Best is trial 134 with value: 0.3757565391314363.
[I 2022-10-24 00:02:19,684] Trial 428 finished with value: 0.3757565391314363 and parameters: {'algorithm': 'ball_tree', 'k_n_neighbors': 10}. Best is trial 134 with value: 0.3757565391314363.
[I 2022-10-24 00:02:41,596] Trial 429 finished with value: 0.3757565391314363 and parameters: {'algorithm': 'ball_tree', 'k_n_neighbors': 10}. Best is trial 134 with value: 0.3757565391314363.
[I 2022-10-24 00:03:04,022] Trial 430 finished with value: 0.3757565391314363 and parameters: {'algorithm': 'ball_tree', 'k_n_neighbors': 10}. Best is trial 134 with value: 0.3757565391314363.
[I 2022-10-24 00:03:26,030] Trial 431 finished with value: 0.3738958658531738 and parameters: {'algorithm': 'ball_tree', 'k_n_neighbors': 9}. Best is trial 134 with value: 0.3757565391314363.
[I 2022-10-24 00:03:49,498] Trial 432 finished with value: 0.3757565391314363 and parameters: {'algorithm': 'ball_tree', 'k_n_neighbors': 10}. Best is trial 134 with value: 0.3757565391314363.
[I 2022-10-24 00:04:13,196] Trial 433 finished with value: 0.3757565391314363 and parameters: {'algorithm': 'ball_tree', 'k_n_neighbors': 10}. Best is trial 134 with value: 0.3757565391314363.
[I 2022-10-24 00:04:36,237] Trial 434 finished with value: 0.3757565391314363 and parameters: {'algorithm': 'ball_tree', 'k_n_neighbors': 10}. Best is trial 134 with value: 0.3757565391314363.
[I 2022-10-24 00:04:59,405] Trial 435 finished with value: 0.3757565391314363 and parameters: {'algorithm': 'ball_tree', 'k_n_neighbors': 10}. Best is trial 134 with value: 0.3757565391314363.
[I 2022-10-24 00:05:22,269] Trial 436 finished with value: 0.3738958658531738 and parameters: {'algorithm': 'ball_tree', 'k_n_neighbors': 9}. Best is trial 134 with value: 0.3757565391314363.
[I 2022-10-24 00:05:44,724] Trial 437 finished with value: 0.3710391400861132 and parameters: {'algorithm': 'ball_tree', 'k_n_neighbors': 8}. Best is trial 134 with value: 0.3757565391314363.
[I 2022-10-24 00:06:08,146] Trial 438 finished with value: 0.3738958658531738 and parameters: {'algorithm': 'ball_tree', 'k_n_neighbors': 9}. Best is trial 134 with value: 0.3757565391314363.
[I 2022-10-24 00:06:31,158] Trial 439 finished with value: 0.3757565391314363 and parameters: {'algorithm': 'ball_tree', 'k_n_neighbors': 10}. Best is trial 134 with value: 0.3757565391314363.
[I 2022-10-24 00:07:09,630] Trial 440 finished with value: 0.375718496832209 and parameters: {'algorithm': 'brute', 'k_n_neighbors': 10}. Best is trial 134 with value: 0.3757565391314363.
[I 2022-10-24 00:07:34,884] Trial 441 finished with value: 0.3757565391314363 and parameters: {'algorithm': 'ball_tree', 'k_n_neighbors': 10}. Best is trial 134 with value: 0.3757565391314363.
[I 2022-10-24 00:07:56,173] Trial 442 finished with value: 0.34783600682734556 and parameters: {'algorithm': 'ball_tree', 'k_n_neighbors': 4}. Best is trial 134 with value: 0.3757565391314363.
[I 2022-10-24 00:08:19,980] Trial 443 finished with value: 0.3757565391314363 and parameters: {'algorithm': 'ball_tree', 'k_n_neighbors': 10}. Best is trial 134 with value: 0.3757565391314363.
[I 2022-10-24 00:08:32,860] Trial 444 finished with value: 0.37572195506537703 and parameters: {'algorithm': 'auto', 'k_n_neighbors': 10}. Best is trial 134 with value: 0.3757565391314363.
[I 2022-10-24 00:08:55,592] Trial 445 finished with value: 0.3738958658531738 and parameters: {'algorithm': 'ball_tree', 'k_n_neighbors': 9}. Best is trial 134 with value: 0.3757565391314363.
[I 2022-10-24 00:09:19,046] Trial 446 finished with value: 0.3757565391314363 and parameters: {'algorithm': 'ball_tree', 'k_n_neighbors': 10}. Best is trial 134 with value: 0.3757565391314363.
[I 2022-10-24 00:09:42,707] Trial 447 finished with value: 0.3757565391314363 and parameters: {'algorithm': 'ball_tree', 'k_n_neighbors': 10}. Best is trial 134 with value: 0.3757565391314363.
[I 2022-10-24 00:10:05,655] Trial 448 finished with value: 0.3738958658531738 and parameters: {'algorithm': 'ball_tree', 'k_n_neighbors': 9}. Best is trial 134 with value: 0.3757565391314363.
[I 2022-10-24 00:10:29,346] Trial 449 finished with value: 0.3757565391314363 and parameters: {'algorithm': 'ball_tree', 'k_n_neighbors': 10}. Best is trial 134 with value: 0.3757565391314363.
[I 2022-10-24 00:10:52,623] Trial 450 finished with value: 0.3757565391314363 and parameters: {'algorithm': 'ball_tree', 'k_n_neighbors': 10}. Best is trial 134 with value: 0.3757565391314363.
[I 2022-10-24 00:11:16,398] Trial 451 finished with value: 0.3757565391314363 and parameters: {'algorithm': 'ball_tree', 'k_n_neighbors': 10}. Best is trial 134 with value: 0.3757565391314363.
[I 2022-10-24 00:11:39,734] Trial 452 finished with value: 0.3757565391314363 and parameters: {'algorithm': 'ball_tree', 'k_n_neighbors': 10}. Best is trial 134 with value: 0.3757565391314363.
[I 2022-10-24 00:12:02,752] Trial 453 finished with value: 0.3738958658531738 and parameters: {'algorithm': 'ball_tree', 'k_n_neighbors': 9}. Best is trial 134 with value: 0.3757565391314363.
[I 2022-10-24 00:12:25,687] Trial 454 finished with value: 0.3757565391314363 and parameters: {'algorithm': 'ball_tree', 'k_n_neighbors': 10}. Best is trial 134 with value: 0.3757565391314363.
