[I 2022-10-23 22:00:47,946] Trial 113 finished with value: 0.37572195506537703 and parameters: {'algorithm': 'kd_tree', 'k_n_neighbors': 10}. Best is trial 11 with value: 0.37572195506537703.
[I 2022-10-23 22:01:00,331] Trial 114 finished with value: 0.37572195506537703 and parameters: {'algorithm': 'kd_tree', 'k_n_neighbors': 10}. Best is trial 11 with value: 0.37572195506537703.
[I 2022-10-23 22:01:12,733] Trial 115 finished with value: 0.37572195506537703 and parameters: {'algorithm': 'kd_tree', 'k_n_neighbors': 10}. Best is trial 11 with value: 0.37572195506537703.
[I 2022-10-23 22:01:25,001] Trial 116 finished with value: 0.37395466102016806 and parameters: {'algorithm': 'kd_tree', 'k_n_neighbors': 9}. Best is trial 11 with value: 0.37572195506537703.
[I 2022-10-23 22:01:37,275] Trial 117 finished with value: 0.37395466102016806 and parameters: {'algorithm': 'kd_tree', 'k_n_neighbors': 9}. Best is trial 11 with value: 0.37572195506537703.
[I 2022-10-23 22:01:49,828] Trial 118 finished with value: 0.37572195506537703 and parameters: {'algorithm': 'kd_tree', 'k_n_neighbors': 10}. Best is trial 11 with value: 0.37572195506537703.
[I 2022-10-23 22:02:02,194] Trial 119 finished with value: 0.37572195506537703 and parameters: {'algorithm': 'kd_tree', 'k_n_neighbors': 10}. Best is trial 11 with value: 0.37572195506537703.
[I 2022-10-23 22:02:14,525] Trial 120 finished with value: 0.37395466102016806 and parameters: {'algorithm': 'kd_tree', 'k_n_neighbors': 9}. Best is trial 11 with value: 0.37572195506537703.
[I 2022-10-23 22:02:27,420] Trial 121 finished with value: 0.37572195506537703 and parameters: {'algorithm': 'kd_tree', 'k_n_neighbors': 10}. Best is trial 11 with value: 0.37572195506537703.
[I 2022-10-23 22:02:39,933] Trial 122 finished with value: 0.37572195506537703 and parameters: {'algorithm': 'kd_tree', 'k_n_neighbors': 10}. Best is trial 11 with value: 0.37572195506537703.
[I 2022-10-23 22:02:54,029] Trial 123 finished with value: 0.37572195506537703 and parameters: {'algorithm': 'kd_tree', 'k_n_neighbors': 10}. Best is trial 11 with value: 0.37572195506537703.
[I 2022-10-23 22:03:06,387] Trial 124 finished with value: 0.37395466102016806 and parameters: {'algorithm': 'kd_tree', 'k_n_neighbors': 9}. Best is trial 11 with value: 0.37572195506537703.
[I 2022-10-23 22:03:18,222] Trial 125 finished with value: 0.37572195506537703 and parameters: {'algorithm': 'kd_tree', 'k_n_neighbors': 10}. Best is trial 11 with value: 0.37572195506537703.
[I 2022-10-23 22:03:32,735] Trial 126 finished with value: 0.37395466102016806 and parameters: {'algorithm': 'auto', 'k_n_neighbors': 9}. Best is trial 11 with value: 0.37572195506537703.
[I 2022-10-23 22:04:12,380] Trial 127 finished with value: 0.375718496832209 and parameters: {'algorithm': 'brute', 'k_n_neighbors': 10}. Best is trial 11 with value: 0.37572195506537703.
[I 2022-10-23 22:04:26,442] Trial 128 finished with value: 0.37572195506537703 and parameters: {'algorithm': 'kd_tree', 'k_n_neighbors': 10}. Best is trial 11 with value: 0.37572195506537703.
[I 2022-10-23 22:04:38,773] Trial 129 finished with value: 0.3710564316705965 and parameters: {'algorithm': 'kd_tree', 'k_n_neighbors': 8}. Best is trial 11 with value: 0.37572195506537703.
[I 2022-10-23 22:04:51,177] Trial 130 finished with value: 0.37395466102016806 and parameters: {'algorithm': 'auto', 'k_n_neighbors': 9}. Best is trial 11 with value: 0.37572195506537703.
[I 2022-10-23 22:05:04,971] Trial 131 finished with value: 0.37572195506537703 and parameters: {'algorithm': 'kd_tree', 'k_n_neighbors': 10}. Best is trial 11 with value: 0.37572195506537703.
[I 2022-10-23 22:05:17,611] Trial 132 finished with value: 0.37572195506537703 and parameters: {'algorithm': 'kd_tree', 'k_n_neighbors': 10}. Best is trial 11 with value: 0.37572195506537703.
[I 2022-10-23 22:05:30,086] Trial 133 finished with value: 0.37572195506537703 and parameters: {'algorithm': 'kd_tree', 'k_n_neighbors': 10}. Best is trial 11 with value: 0.37572195506537703.
[I 2022-10-23 22:05:54,339] Trial 134 finished with value: 0.3757565391314363 and parameters: {'algorithm': 'ball_tree', 'k_n_neighbors': 10}. Best is trial 134 with value: 0.3757565391314363.
[I 2022-10-23 22:06:16,238] Trial 135 finished with value: 0.3647169874830416 and parameters: {'algorithm': 'ball_tree', 'k_n_neighbors': 6}. Best is trial 134 with value: 0.3757565391314363.
[I 2022-10-23 22:06:40,688] Trial 136 finished with value: 0.3738958658531738 and parameters: {'algorithm': 'ball_tree', 'k_n_neighbors': 9}. Best is trial 134 with value: 0.3757565391314363.
[I 2022-10-23 22:07:03,400] Trial 137 finished with value: 0.3757565391314363 and parameters: {'algorithm': 'ball_tree', 'k_n_neighbors': 10}. Best is trial 134 with value: 0.3757565391314363.
[I 2022-10-23 22:07:28,031] Trial 138 finished with value: 0.3738958658531738 and parameters: {'algorithm': 'ball_tree', 'k_n_neighbors': 9}. Best is trial 134 with value: 0.3757565391314363.
[I 2022-10-23 22:07:52,994] Trial 139 finished with value: 0.3757565391314363 and parameters: {'algorithm': 'ball_tree', 'k_n_neighbors': 10}. Best is trial 134 with value: 0.3757565391314363.
[I 2022-10-23 22:08:18,367] Trial 140 finished with value: 0.3757565391314363 and parameters: {'algorithm': 'ball_tree', 'k_n_neighbors': 10}. Best is trial 134 with value: 0.3757565391314363.
[I 2022-10-23 22:08:43,506] Trial 141 finished with value: 0.3757565391314363 and parameters: {'algorithm': 'ball_tree', 'k_n_neighbors': 10}. Best is trial 134 with value: 0.3757565391314363.
[I 2022-10-23 22:09:08,332] Trial 142 finished with value: 0.3738958658531738 and parameters: {'algorithm': 'ball_tree', 'k_n_neighbors': 9}. Best is trial 134 with value: 0.3757565391314363.
[I 2022-10-23 22:09:33,599] Trial 143 finished with value: 0.3757565391314363 and parameters: {'algorithm': 'ball_tree', 'k_n_neighbors': 10}. Best is trial 134 with value: 0.3757565391314363.
[I 2022-10-23 22:09:58,651] Trial 144 finished with value: 0.3757565391314363 and parameters: {'algorithm': 'ball_tree', 'k_n_neighbors': 10}. Best is trial 134 with value: 0.3757565391314363.
[I 2022-10-23 22:10:24,385] Trial 145 finished with value: 0.3757565391314363 and parameters: {'algorithm': 'ball_tree', 'k_n_neighbors': 10}. Best is trial 134 with value: 0.3757565391314363.
[I 2022-10-23 22:10:49,580] Trial 146 finished with value: 0.3757565391314363 and parameters: {'algorithm': 'ball_tree', 'k_n_neighbors': 10}. Best is trial 134 with value: 0.3757565391314363.
[I 2022-10-23 22:11:14,340] Trial 147 finished with value: 0.3757565391314363 and parameters: {'algorithm': 'ball_tree', 'k_n_neighbors': 10}. Best is trial 134 with value: 0.3757565391314363.
[I 2022-10-23 22:11:39,238] Trial 148 finished with value: 0.3738958658531738 and parameters: {'algorithm': 'ball_tree', 'k_n_neighbors': 9}. Best is trial 134 with value: 0.3757565391314363.
[I 2022-10-23 22:12:03,872] Trial 149 finished with value: 0.3757565391314363 and parameters: {'algorithm': 'ball_tree', 'k_n_neighbors': 10}. Best is trial 134 with value: 0.3757565391314363.
[I 2022-10-23 22:12:28,624] Trial 150 finished with value: 0.3757565391314363 and parameters: {'algorithm': 'ball_tree', 'k_n_neighbors': 10}. Best is trial 134 with value: 0.3757565391314363.
[I 2022-10-23 22:12:53,686] Trial 151 finished with value: 0.3757565391314363 and parameters: {'algorithm': 'ball_tree', 'k_n_neighbors': 10}. Best is trial 134 with value: 0.3757565391314363.
[I 2022-10-23 22:13:18,096] Trial 152 finished with value: 0.3757565391314363 and parameters: {'algorithm': 'ball_tree', 'k_n_neighbors': 10}. Best is trial 134 with value: 0.3757565391314363.
[I 2022-10-23 22:13:42,603] Trial 153 finished with value: 0.3738958658531738 and parameters: {'algorithm': 'ball_tree', 'k_n_neighbors': 9}. Best is trial 134 with value: 0.3757565391314363.
[I 2022-10-23 22:14:07,623] Trial 154 finished with value: 0.3757565391314363 and parameters: {'algorithm': 'ball_tree', 'k_n_neighbors': 10}. Best is trial 134 with value: 0.3757565391314363.
[I 2022-10-23 22:14:32,341] Trial 155 finished with value: 0.3757565391314363 and parameters: {'algorithm': 'ball_tree', 'k_n_neighbors': 10}. Best is trial 134 with value: 0.3757565391314363.
[I 2022-10-23 22:14:57,538] Trial 156 finished with value: 0.3757565391314363 and parameters: {'algorithm': 'ball_tree', 'k_n_neighbors': 10}. Best is trial 134 with value: 0.3757565391314363.
[I 2022-10-23 22:15:21,795] Trial 157 finished with value: 0.3738958658531738 and parameters: {'algorithm': 'ball_tree', 'k_n_neighbors': 9}. Best is trial 134 with value: 0.3757565391314363.
[I 2022-10-23 22:15:46,441] Trial 158 finished with value: 0.3757565391314363 and parameters: {'algorithm': 'ball_tree', 'k_n_neighbors': 10}. Best is trial 134 with value: 0.3757565391314363.
[I 2022-10-23 22:16:11,388] Trial 159 finished with value: 0.3757565391314363 and parameters: {'algorithm': 'ball_tree', 'k_n_neighbors': 10}. Best is trial 134 with value: 0.3757565391314363.
[I 2022-10-23 22:16:35,595] Trial 160 finished with value: 0.3738958658531738 and parameters: {'algorithm': 'ball_tree', 'k_n_neighbors': 9}. Best is trial 134 with value: 0.3757565391314363.
[I 2022-10-23 22:17:00,289] Trial 161 finished with value: 0.3757565391314363 and parameters: {'algorithm': 'ball_tree', 'k_n_neighbors': 10}. Best is trial 134 with value: 0.3757565391314363.
[I 2022-10-23 22:17:24,045] Trial 162 finished with value: 0.3757565391314363 and parameters: {'algorithm': 'ball_tree', 'k_n_neighbors': 10}. Best is trial 134 with value: 0.3757565391314363.
[I 2022-10-23 22:17:47,139] Trial 163 finished with value: 0.3757565391314363 and parameters: {'algorithm': 'ball_tree', 'k_n_neighbors': 10}. Best is trial 134 with value: 0.3757565391314363.
[I 2022-10-23 22:18:10,322] Trial 164 finished with value: 0.3757565391314363 and parameters: {'algorithm': 'ball_tree', 'k_n_neighbors': 10}. Best is trial 134 with value: 0.3757565391314363.
[I 2022-10-23 22:18:33,615] Trial 165 finished with value: 0.3757565391314363 and parameters: {'algorithm': 'ball_tree', 'k_n_neighbors': 10}. Best is trial 134 with value: 0.3757565391314363.
[I 2022-10-23 22:18:56,039] Trial 166 finished with value: 0.3738958658531738 and parameters: {'algorithm': 'ball_tree', 'k_n_neighbors': 9}. Best is trial 134 with value: 0.3757565391314363.
[I 2022-10-23 22:19:19,747] Trial 167 finished with value: 0.3757565391314363 and parameters: {'algorithm': 'ball_tree', 'k_n_neighbors': 10}. Best is trial 134 with value: 0.3757565391314363.
[I 2022-10-23 22:19:42,815] Trial 168 finished with value: 0.3738958658531738 and parameters: {'algorithm': 'ball_tree', 'k_n_neighbors': 9}. Best is trial 134 with value: 0.3757565391314363.
[I 2022-10-23 22:20:05,861] Trial 169 finished with value: 0.3757565391314363 and parameters: {'algorithm': 'ball_tree', 'k_n_neighbors': 10}. Best is trial 134 with value: 0.3757565391314363.
[I 2022-10-23 22:20:29,339] Trial 170 finished with value: 0.3757565391314363 and parameters: {'algorithm': 'ball_tree', 'k_n_neighbors': 10}. Best is trial 134 with value: 0.3757565391314363.
[I 2022-10-23 22:20:52,583] Trial 171 finished with value: 0.3757565391314363 and parameters: {'algorithm': 'ball_tree', 'k_n_neighbors': 10}. Best is trial 134 with value: 0.3757565391314363.
[I 2022-10-23 22:21:15,784] Trial 172 finished with value: 0.3757565391314363 and parameters: {'algorithm': 'ball_tree', 'k_n_neighbors': 10}. Best is trial 134 with value: 0.3757565391314363.
[I 2022-10-23 22:21:40,785] Trial 173 finished with value: 0.3757565391314363 and parameters: {'algorithm': 'ball_tree', 'k_n_neighbors': 10}. Best is trial 134 with value: 0.3757565391314363.
[I 2022-10-23 22:22:05,652] Trial 174 finished with value: 0.3757565391314363 and parameters: {'algorithm': 'ball_tree', 'k_n_neighbors': 10}. Best is trial 134 with value: 0.3757565391314363.
[I 2022-10-23 22:22:30,624] Trial 175 finished with value: 0.3757565391314363 and parameters: {'algorithm': 'ball_tree', 'k_n_neighbors': 10}. Best is trial 134 with value: 0.3757565391314363.
[I 2022-10-23 22:22:55,208] Trial 176 finished with value: 0.3738958658531738 and parameters: {'algorithm': 'ball_tree', 'k_n_neighbors': 9}. Best is trial 134 with value: 0.3757565391314363.
[I 2022-10-23 22:23:17,023] Trial 177 finished with value: 0.3400197775842936 and parameters: {'algorithm': 'ball_tree', 'k_n_neighbors': 3}. Best is trial 134 with value: 0.3757565391314363.
[I 2022-10-23 22:23:42,224] Trial 178 finished with value: 0.3757565391314363 and parameters: {'algorithm': 'ball_tree', 'k_n_neighbors': 10}. Best is trial 134 with value: 0.3757565391314363.
[I 2022-10-23 22:24:06,976] Trial 179 finished with value: 0.3738958658531738 and parameters: {'algorithm': 'ball_tree', 'k_n_neighbors': 9}. Best is trial 134 with value: 0.3757565391314363.
[I 2022-10-23 22:24:31,905] Trial 180 finished with value: 0.3757565391314363 and parameters: {'algorithm': 'ball_tree', 'k_n_neighbors': 10}. Best is trial 134 with value: 0.3757565391314363.
[I 2022-10-23 22:24:57,447] Trial 181 finished with value: 0.3757565391314363 and parameters: {'algorithm': 'ball_tree', 'k_n_neighbors': 10}. Best is trial 134 with value: 0.3757565391314363.
[I 2022-10-23 22:25:22,326] Trial 182 finished with value: 0.3757565391314363 and parameters: {'algorithm': 'ball_tree', 'k_n_neighbors': 10}. Best is trial 134 with value: 0.3757565391314363.
[I 2022-10-23 22:25:47,152] Trial 183 finished with value: 0.3757565391314363 and parameters: {'algorithm': 'ball_tree', 'k_n_neighbors': 10}. Best is trial 134 with value: 0.3757565391314363.
[I 2022-10-23 22:26:12,272] Trial 184 finished with value: 0.3757565391314363 and parameters: {'algorithm': 'ball_tree', 'k_n_neighbors': 10}. Best is trial 134 with value: 0.3757565391314363.
[I 2022-10-23 22:26:36,784] Trial 185 finished with value: 0.3738958658531738 and parameters: {'algorithm': 'ball_tree', 'k_n_neighbors': 9}. Best is trial 134 with value: 0.3757565391314363.
[I 2022-10-23 22:27:01,438] Trial 186 finished with value: 0.3757565391314363 and parameters: {'algorithm': 'ball_tree', 'k_n_neighbors': 10}. Best is trial 134 with value: 0.3757565391314363.
[I 2022-10-23 22:27:26,291] Trial 187 finished with value: 0.3757565391314363 and parameters: {'algorithm': 'ball_tree', 'k_n_neighbors': 10}. Best is trial 134 with value: 0.3757565391314363.
[I 2022-10-23 22:27:50,832] Trial 188 finished with value: 0.3738958658531738 and parameters: {'algorithm': 'ball_tree', 'k_n_neighbors': 9}. Best is trial 134 with value: 0.3757565391314363.
[I 2022-10-23 22:28:16,358] Trial 189 finished with value: 0.3757565391314363 and parameters: {'algorithm': 'ball_tree', 'k_n_neighbors': 10}. Best is trial 134 with value: 0.3757565391314363.
[I 2022-10-23 22:28:41,127] Trial 190 finished with value: 0.3757565391314363 and parameters: {'algorithm': 'ball_tree', 'k_n_neighbors': 10}. Best is trial 134 with value: 0.3757565391314363.
[I 2022-10-23 22:29:06,156] Trial 191 finished with value: 0.3757565391314363 and parameters: {'algorithm': 'ball_tree', 'k_n_neighbors': 10}. Best is trial 134 with value: 0.3757565391314363.
[I 2022-10-23 22:29:31,379] Trial 192 finished with value: 0.3757565391314363 and parameters: {'algorithm': 'ball_tree', 'k_n_neighbors': 10}. Best is trial 134 with value: 0.3757565391314363.
[I 2022-10-23 22:29:56,538] Trial 193 finished with value: 0.3757565391314363 and parameters: {'algorithm': 'ball_tree', 'k_n_neighbors': 10}. Best is trial 134 with value: 0.3757565391314363.
[I 2022-10-23 22:30:21,894] Trial 194 finished with value: 0.3757565391314363 and parameters: {'algorithm': 'ball_tree', 'k_n_neighbors': 10}. Best is trial 134 with value: 0.3757565391314363.
[I 2022-10-23 22:30:46,762] Trial 195 finished with value: 0.3757565391314363 and parameters: {'algorithm': 'ball_tree', 'k_n_neighbors': 10}. Best is trial 134 with value: 0.3757565391314363.
[I 2022-10-23 22:31:10,719] Trial 196 finished with value: 0.3738958658531738 and parameters: {'algorithm': 'ball_tree', 'k_n_neighbors': 9}. Best is trial 134 with value: 0.3757565391314363.
[I 2022-10-23 22:31:33,948] Trial 197 finished with value: 0.3757565391314363 and parameters: {'algorithm': 'ball_tree', 'k_n_neighbors': 10}. Best is trial 134 with value: 0.3757565391314363.
[I 2022-10-23 22:31:56,823] Trial 198 finished with value: 0.3757565391314363 and parameters: {'algorithm': 'ball_tree', 'k_n_neighbors': 10}. Best is trial 134 with value: 0.3757565391314363.
[I 2022-10-23 22:32:19,701] Trial 199 finished with value: 0.3738958658531738 and parameters: {'algorithm': 'ball_tree', 'k_n_neighbors': 9}. Best is trial 134 with value: 0.3757565391314363.
[I 2022-10-23 22:32:41,222] Trial 200 finished with value: 0.3647169874830416 and parameters: {'algorithm': 'ball_tree', 'k_n_neighbors': 6}. Best is trial 134 with value: 0.3757565391314363.
[I 2022-10-23 22:33:03,935] Trial 201 finished with value: 0.3757565391314363 and parameters: {'algorithm': 'ball_tree', 'k_n_neighbors': 10}. Best is trial 134 with value: 0.3757565391314363.
[I 2022-10-23 22:33:26,951] Trial 202 finished with value: 0.3757565391314363 and parameters: {'algorithm': 'ball_tree', 'k_n_neighbors': 10}. Best is trial 134 with value: 0.3757565391314363.
[I 2022-10-23 22:33:50,395] Trial 203 finished with value: 0.3757565391314363 and parameters: {'algorithm': 'ball_tree', 'k_n_neighbors': 10}. Best is trial 134 with value: 0.3757565391314363.
[I 2022-10-23 22:34:13,246] Trial 204 finished with value: 0.3757565391314363 and parameters: {'algorithm': 'ball_tree', 'k_n_neighbors': 10}. Best is trial 134 with value: 0.3757565391314363.
[I 2022-10-23 22:34:36,535] Trial 205 finished with value: 0.3757565391314363 and parameters: {'algorithm': 'ball_tree', 'k_n_neighbors': 10}. Best is trial 134 with value: 0.3757565391314363.
[I 2022-10-23 22:35:00,406] Trial 206 finished with value: 0.3757565391314363 and parameters: {'algorithm': 'ball_tree', 'k_n_neighbors': 10}. Best is trial 134 with value: 0.3757565391314363.
[I 2022-10-23 22:35:23,165] Trial 207 finished with value: 0.3738958658531738 and parameters: {'algorithm': 'ball_tree', 'k_n_neighbors': 9}. Best is trial 134 with value: 0.3757565391314363.
[I 2022-10-23 22:35:46,298] Trial 208 finished with value: 0.3757565391314363 and parameters: {'algorithm': 'ball_tree', 'k_n_neighbors': 10}. Best is trial 134 with value: 0.3757565391314363.
[I 2022-10-23 22:36:09,377] Trial 209 finished with value: 0.3757565391314363 and parameters: {'algorithm': 'ball_tree', 'k_n_neighbors': 10}. Best is trial 134 with value: 0.3757565391314363.
[I 2022-10-23 22:36:32,176] Trial 210 finished with value: 0.3757565391314363 and parameters: {'algorithm': 'ball_tree', 'k_n_neighbors': 10}. Best is trial 134 with value: 0.3757565391314363.
[I 2022-10-23 22:36:56,146] Trial 211 finished with value: 0.3757565391314363 and parameters: {'algorithm': 'ball_tree', 'k_n_neighbors': 10}. Best is trial 134 with value: 0.3757565391314363.
[I 2022-10-23 22:37:20,249] Trial 212 finished with value: 0.3757565391314363 and parameters: {'algorithm': 'ball_tree', 'k_n_neighbors': 10}. Best is trial 134 with value: 0.3757565391314363.
[I 2022-10-23 22:37:45,206] Trial 213 finished with value: 0.3757565391314363 and parameters: {'algorithm': 'ball_tree', 'k_n_neighbors': 10}. Best is trial 134 with value: 0.3757565391314363.
[I 2022-10-23 22:38:10,393] Trial 214 finished with value: 0.3757565391314363 and parameters: {'algorithm': 'ball_tree', 'k_n_neighbors': 10}. Best is trial 134 with value: 0.3757565391314363.
[I 2022-10-23 22:38:35,457] Trial 215 finished with value: 0.3757565391314363 and parameters: {'algorithm': 'ball_tree', 'k_n_neighbors': 10}. Best is trial 134 with value: 0.3757565391314363.
[I 2022-10-23 22:39:00,045] Trial 216 finished with value: 0.3757565391314363 and parameters: {'algorithm': 'ball_tree', 'k_n_neighbors': 10}. Best is trial 134 with value: 0.3757565391314363.
[I 2022-10-23 22:39:24,569] Trial 217 finished with value: 0.3738958658531738 and parameters: {'algorithm': 'ball_tree', 'k_n_neighbors': 9}. Best is trial 134 with value: 0.3757565391314363.
[I 2022-10-23 22:39:49,689] Trial 218 finished with value: 0.3757565391314363 and parameters: {'algorithm': 'ball_tree', 'k_n_neighbors': 10}. Best is trial 134 with value: 0.3757565391314363.
[I 2022-10-23 22:40:13,045] Trial 219 finished with value: 0.3570978929605617 and parameters: {'algorithm': 'ball_tree', 'k_n_neighbors': 5}. Best is trial 134 with value: 0.3757565391314363.
[I 2022-10-23 22:40:37,676] Trial 220 finished with value: 0.3738958658531738 and parameters: {'algorithm': 'ball_tree', 'k_n_neighbors': 9}. Best is trial 134 with value: 0.3757565391314363.
[I 2022-10-23 22:41:02,532] Trial 221 finished with value: 0.3757565391314363 and parameters: {'algorithm': 'ball_tree', 'k_n_neighbors': 10}. Best is trial 134 with value: 0.3757565391314363.
[I 2022-10-23 22:41:27,945] Trial 222 finished with value: 0.3757565391314363 and parameters: {'algorithm': 'ball_tree', 'k_n_neighbors': 10}. Best is trial 134 with value: 0.3757565391314363.
[I 2022-10-23 22:41:52,673] Trial 223 finished with value: 0.3757565391314363 and parameters: {'algorithm': 'ball_tree', 'k_n_neighbors': 10}. Best is trial 134 with value: 0.3757565391314363.
[I 2022-10-23 22:42:17,434] Trial 224 finished with value: 0.3757565391314363 and parameters: {'algorithm': 'ball_tree', 'k_n_neighbors': 10}. Best is trial 134 with value: 0.3757565391314363.
[I 2022-10-23 22:42:42,376] Trial 225 finished with value: 0.3757565391314363 and parameters: {'algorithm': 'ball_tree', 'k_n_neighbors': 10}. Best is trial 134 with value: 0.3757565391314363.
[I 2022-10-23 22:43:07,412] Trial 226 finished with value: 0.3757565391314363 and parameters: {'algorithm': 'ball_tree', 'k_n_neighbors': 10}. Best is trial 134 with value: 0.3757565391314363.
