[I 2022-10-23 22:43:33,358] Trial 227 finished with value: 0.3757565391314363 and parameters: {'algorithm': 'ball_tree', 'k_n_neighbors': 10}. Best is trial 134 with value: 0.3757565391314363.
[I 2022-10-23 22:44:14,512] Trial 228 finished with value: 0.3738370721813343 and parameters: {'algorithm': 'brute', 'k_n_neighbors': 9}. Best is trial 134 with value: 0.3757565391314363.
[I 2022-10-23 22:44:39,683] Trial 229 finished with value: 0.3757565391314363 and parameters: {'algorithm': 'ball_tree', 'k_n_neighbors': 10}. Best is trial 134 with value: 0.3757565391314363.
[I 2022-10-23 22:45:04,711] Trial 230 finished with value: 0.3757565391314363 and parameters: {'algorithm': 'ball_tree', 'k_n_neighbors': 10}. Best is trial 134 with value: 0.3757565391314363.
[I 2022-10-23 22:45:29,631] Trial 231 finished with value: 0.3757565391314363 and parameters: {'algorithm': 'ball_tree', 'k_n_neighbors': 10}. Best is trial 134 with value: 0.3757565391314363.
[I 2022-10-23 22:45:54,692] Trial 232 finished with value: 0.3757565391314363 and parameters: {'algorithm': 'ball_tree', 'k_n_neighbors': 10}. Best is trial 134 with value: 0.3757565391314363.
[I 2022-10-23 22:46:18,970] Trial 233 finished with value: 0.3757565391314363 and parameters: {'algorithm': 'ball_tree', 'k_n_neighbors': 10}. Best is trial 134 with value: 0.3757565391314363.
[I 2022-10-23 22:46:44,067] Trial 234 finished with value: 0.3757565391314363 and parameters: {'algorithm': 'ball_tree', 'k_n_neighbors': 10}. Best is trial 134 with value: 0.3757565391314363.
[I 2022-10-23 22:47:09,113] Trial 235 finished with value: 0.3757565391314363 and parameters: {'algorithm': 'ball_tree', 'k_n_neighbors': 10}. Best is trial 134 with value: 0.3757565391314363.
[I 2022-10-23 22:47:34,157] Trial 236 finished with value: 0.3757565391314363 and parameters: {'algorithm': 'ball_tree', 'k_n_neighbors': 10}. Best is trial 134 with value: 0.3757565391314363.
[I 2022-10-23 22:47:59,589] Trial 237 finished with value: 0.3757565391314363 and parameters: {'algorithm': 'ball_tree', 'k_n_neighbors': 10}. Best is trial 134 with value: 0.3757565391314363.
[I 2022-10-23 22:48:24,024] Trial 238 finished with value: 0.3757565391314363 and parameters: {'algorithm': 'ball_tree', 'k_n_neighbors': 10}. Best is trial 134 with value: 0.3757565391314363.
[I 2022-10-23 22:48:47,350] Trial 239 finished with value: 0.3738958658531738 and parameters: {'algorithm': 'ball_tree', 'k_n_neighbors': 9}. Best is trial 134 with value: 0.3757565391314363.
[I 2022-10-23 22:49:10,673] Trial 240 finished with value: 0.3757565391314363 and parameters: {'algorithm': 'ball_tree', 'k_n_neighbors': 10}. Best is trial 134 with value: 0.3757565391314363.
[I 2022-10-23 22:49:33,389] Trial 241 finished with value: 0.3757565391314363 and parameters: {'algorithm': 'ball_tree', 'k_n_neighbors': 10}. Best is trial 134 with value: 0.3757565391314363.
[I 2022-10-23 22:49:56,816] Trial 242 finished with value: 0.3757565391314363 and parameters: {'algorithm': 'ball_tree', 'k_n_neighbors': 10}. Best is trial 134 with value: 0.3757565391314363.
[I 2022-10-23 22:50:20,084] Trial 243 finished with value: 0.3757565391314363 and parameters: {'algorithm': 'ball_tree', 'k_n_neighbors': 10}. Best is trial 134 with value: 0.3757565391314363.
[I 2022-10-23 22:50:43,159] Trial 244 finished with value: 0.3757565391314363 and parameters: {'algorithm': 'ball_tree', 'k_n_neighbors': 10}. Best is trial 134 with value: 0.3757565391314363.
[I 2022-10-23 22:51:06,313] Trial 245 finished with value: 0.3757565391314363 and parameters: {'algorithm': 'ball_tree', 'k_n_neighbors': 10}. Best is trial 134 with value: 0.3757565391314363.
[I 2022-10-23 22:51:31,147] Trial 246 finished with value: 0.3757565391314363 and parameters: {'algorithm': 'ball_tree', 'k_n_neighbors': 10}. Best is trial 134 with value: 0.3757565391314363.
[I 2022-10-23 22:51:55,827] Trial 247 finished with value: 0.3757565391314363 and parameters: {'algorithm': 'ball_tree', 'k_n_neighbors': 10}. Best is trial 134 with value: 0.3757565391314363.
[I 2022-10-23 22:52:20,982] Trial 248 finished with value: 0.3757565391314363 and parameters: {'algorithm': 'ball_tree', 'k_n_neighbors': 10}. Best is trial 134 with value: 0.3757565391314363.
[I 2022-10-23 22:52:45,549] Trial 249 finished with value: 0.3757565391314363 and parameters: {'algorithm': 'ball_tree', 'k_n_neighbors': 10}. Best is trial 134 with value: 0.3757565391314363.
[I 2022-10-23 22:53:10,064] Trial 250 finished with value: 0.3738958658531738 and parameters: {'algorithm': 'ball_tree', 'k_n_neighbors': 9}. Best is trial 134 with value: 0.3757565391314363.
[I 2022-10-23 22:53:35,399] Trial 251 finished with value: 0.3757565391314363 and parameters: {'algorithm': 'ball_tree', 'k_n_neighbors': 10}. Best is trial 134 with value: 0.3757565391314363.
[I 2022-10-23 22:54:00,087] Trial 252 finished with value: 0.3738958658531738 and parameters: {'algorithm': 'ball_tree', 'k_n_neighbors': 9}. Best is trial 134 with value: 0.3757565391314363.
[I 2022-10-23 22:54:25,108] Trial 253 finished with value: 0.3757565391314363 and parameters: {'algorithm': 'ball_tree', 'k_n_neighbors': 10}. Best is trial 134 with value: 0.3757565391314363.
[I 2022-10-23 22:54:50,114] Trial 254 finished with value: 0.3757565391314363 and parameters: {'algorithm': 'ball_tree', 'k_n_neighbors': 10}. Best is trial 134 with value: 0.3757565391314363.
[I 2022-10-23 22:55:15,002] Trial 255 finished with value: 0.3757565391314363 and parameters: {'algorithm': 'ball_tree', 'k_n_neighbors': 10}. Best is trial 134 with value: 0.3757565391314363.
[I 2022-10-23 22:55:37,524] Trial 256 finished with value: 0.34783600682734556 and parameters: {'algorithm': 'ball_tree', 'k_n_neighbors': 4}. Best is trial 134 with value: 0.3757565391314363.
[I 2022-10-23 22:56:02,710] Trial 257 finished with value: 0.3757565391314363 and parameters: {'algorithm': 'ball_tree', 'k_n_neighbors': 10}. Best is trial 134 with value: 0.3757565391314363.
[I 2022-10-23 22:56:43,992] Trial 258 finished with value: 0.3395943833269632 and parameters: {'algorithm': 'brute', 'k_n_neighbors': 2}. Best is trial 134 with value: 0.3757565391314363.
[I 2022-10-23 22:57:08,663] Trial 259 finished with value: 0.3738958658531738 and parameters: {'algorithm': 'ball_tree', 'k_n_neighbors': 9}. Best is trial 134 with value: 0.3757565391314363.
[I 2022-10-23 22:57:34,317] Trial 260 finished with value: 0.3757565391314363 and parameters: {'algorithm': 'ball_tree', 'k_n_neighbors': 10}. Best is trial 134 with value: 0.3757565391314363.
[I 2022-10-23 22:57:59,556] Trial 261 finished with value: 0.3757565391314363 and parameters: {'algorithm': 'ball_tree', 'k_n_neighbors': 10}. Best is trial 134 with value: 0.3757565391314363.
[I 2022-10-23 22:58:24,384] Trial 262 finished with value: 0.3757565391314363 and parameters: {'algorithm': 'ball_tree', 'k_n_neighbors': 10}. Best is trial 134 with value: 0.3757565391314363.
[I 2022-10-23 22:58:48,991] Trial 263 finished with value: 0.3738958658531738 and parameters: {'algorithm': 'ball_tree', 'k_n_neighbors': 9}. Best is trial 134 with value: 0.3757565391314363.
[I 2022-10-23 22:59:14,109] Trial 264 finished with value: 0.3757565391314363 and parameters: {'algorithm': 'ball_tree', 'k_n_neighbors': 10}. Best is trial 134 with value: 0.3757565391314363.
[I 2022-10-23 22:59:38,815] Trial 265 finished with value: 0.3738958658531738 and parameters: {'algorithm': 'ball_tree', 'k_n_neighbors': 9}. Best is trial 134 with value: 0.3757565391314363.
[I 2022-10-23 23:00:04,311] Trial 266 finished with value: 0.3757565391314363 and parameters: {'algorithm': 'ball_tree', 'k_n_neighbors': 10}. Best is trial 134 with value: 0.3757565391314363.
[I 2022-10-23 23:00:29,266] Trial 267 finished with value: 0.3757565391314363 and parameters: {'algorithm': 'ball_tree', 'k_n_neighbors': 10}. Best is trial 134 with value: 0.3757565391314363.
[I 2022-10-23 23:00:54,404] Trial 268 finished with value: 0.3757565391314363 and parameters: {'algorithm': 'ball_tree', 'k_n_neighbors': 10}. Best is trial 134 with value: 0.3757565391314363.
[I 2022-10-23 23:01:19,963] Trial 269 finished with value: 0.3757565391314363 and parameters: {'algorithm': 'ball_tree', 'k_n_neighbors': 10}. Best is trial 134 with value: 0.3757565391314363.
[I 2022-10-23 23:01:44,785] Trial 270 finished with value: 0.3738958658531738 and parameters: {'algorithm': 'ball_tree', 'k_n_neighbors': 9}. Best is trial 134 with value: 0.3757565391314363.
[I 2022-10-23 23:02:09,998] Trial 271 finished with value: 0.3757565391314363 and parameters: {'algorithm': 'ball_tree', 'k_n_neighbors': 10}. Best is trial 134 with value: 0.3757565391314363.
[I 2022-10-23 23:02:34,457] Trial 272 finished with value: 0.3757565391314363 and parameters: {'algorithm': 'ball_tree', 'k_n_neighbors': 10}. Best is trial 134 with value: 0.3757565391314363.
[I 2022-10-23 23:02:57,222] Trial 273 finished with value: 0.3738958658531738 and parameters: {'algorithm': 'ball_tree', 'k_n_neighbors': 9}. Best is trial 134 with value: 0.3757565391314363.
[I 2022-10-23 23:03:20,908] Trial 274 finished with value: 0.3757565391314363 and parameters: {'algorithm': 'ball_tree', 'k_n_neighbors': 10}. Best is trial 134 with value: 0.3757565391314363.
[I 2022-10-23 23:03:44,288] Trial 275 finished with value: 0.3757565391314363 and parameters: {'algorithm': 'ball_tree', 'k_n_neighbors': 10}. Best is trial 134 with value: 0.3757565391314363.
[I 2022-10-23 23:04:07,448] Trial 276 finished with value: 0.3757565391314363 and parameters: {'algorithm': 'ball_tree', 'k_n_neighbors': 10}. Best is trial 134 with value: 0.3757565391314363.
[I 2022-10-23 23:04:30,538] Trial 277 finished with value: 0.3738958658531738 and parameters: {'algorithm': 'ball_tree', 'k_n_neighbors': 9}. Best is trial 134 with value: 0.3757565391314363.
[I 2022-10-23 23:04:52,160] Trial 278 finished with value: 0.3757565391314363 and parameters: {'algorithm': 'ball_tree', 'k_n_neighbors': 10}. Best is trial 134 with value: 0.3757565391314363.
[I 2022-10-23 23:05:31,006] Trial 279 finished with value: 0.375718496832209 and parameters: {'algorithm': 'brute', 'k_n_neighbors': 10}. Best is trial 134 with value: 0.3757565391314363.
[I 2022-10-23 23:05:53,272] Trial 280 finished with value: 0.3757565391314363 and parameters: {'algorithm': 'ball_tree', 'k_n_neighbors': 10}. Best is trial 134 with value: 0.3757565391314363.
[I 2022-10-23 23:06:15,469] Trial 281 finished with value: 0.3738958658531738 and parameters: {'algorithm': 'ball_tree', 'k_n_neighbors': 9}. Best is trial 134 with value: 0.3757565391314363.
[I 2022-10-23 23:06:37,038] Trial 282 finished with value: 0.3757565391314363 and parameters: {'algorithm': 'ball_tree', 'k_n_neighbors': 10}. Best is trial 134 with value: 0.3757565391314363.
[I 2022-10-23 23:06:58,451] Trial 283 finished with value: 0.3757565391314363 and parameters: {'algorithm': 'ball_tree', 'k_n_neighbors': 10}. Best is trial 134 with value: 0.3757565391314363.
[I 2022-10-23 23:07:19,738] Trial 284 finished with value: 0.3757565391314363 and parameters: {'algorithm': 'ball_tree', 'k_n_neighbors': 10}. Best is trial 134 with value: 0.3757565391314363.
[I 2022-10-23 23:07:41,077] Trial 285 finished with value: 0.3757565391314363 and parameters: {'algorithm': 'ball_tree', 'k_n_neighbors': 10}. Best is trial 134 with value: 0.3757565391314363.
[I 2022-10-23 23:08:03,103] Trial 286 finished with value: 0.3738958658531738 and parameters: {'algorithm': 'ball_tree', 'k_n_neighbors': 9}. Best is trial 134 with value: 0.3757565391314363.
[I 2022-10-23 23:08:24,649] Trial 287 finished with value: 0.3757565391314363 and parameters: {'algorithm': 'ball_tree', 'k_n_neighbors': 10}. Best is trial 134 with value: 0.3757565391314363.
[I 2022-10-23 23:08:46,716] Trial 288 finished with value: 0.3757565391314363 and parameters: {'algorithm': 'ball_tree', 'k_n_neighbors': 10}. Best is trial 134 with value: 0.3757565391314363.
[I 2022-10-23 23:09:08,349] Trial 289 finished with value: 0.3757565391314363 and parameters: {'algorithm': 'ball_tree', 'k_n_neighbors': 10}. Best is trial 134 with value: 0.3757565391314363.
[I 2022-10-23 23:09:29,725] Trial 290 finished with value: 0.3757565391314363 and parameters: {'algorithm': 'ball_tree', 'k_n_neighbors': 10}. Best is trial 134 with value: 0.3757565391314363.
[I 2022-10-23 23:09:50,592] Trial 291 finished with value: 0.3738958658531738 and parameters: {'algorithm': 'ball_tree', 'k_n_neighbors': 9}. Best is trial 134 with value: 0.3757565391314363.
[I 2022-10-23 23:10:12,003] Trial 292 finished with value: 0.3738958658531738 and parameters: {'algorithm': 'ball_tree', 'k_n_neighbors': 9}. Best is trial 134 with value: 0.3757565391314363.
[I 2022-10-23 23:10:33,396] Trial 293 finished with value: 0.3757565391314363 and parameters: {'algorithm': 'ball_tree', 'k_n_neighbors': 10}. Best is trial 134 with value: 0.3757565391314363.
[I 2022-10-23 23:10:55,009] Trial 294 finished with value: 0.3757565391314363 and parameters: {'algorithm': 'ball_tree', 'k_n_neighbors': 10}. Best is trial 134 with value: 0.3757565391314363.
[I 2022-10-23 23:11:16,571] Trial 295 finished with value: 0.3757565391314363 and parameters: {'algorithm': 'ball_tree', 'k_n_neighbors': 10}. Best is trial 134 with value: 0.3757565391314363.
[I 2022-10-23 23:11:38,077] Trial 296 finished with value: 0.3757565391314363 and parameters: {'algorithm': 'ball_tree', 'k_n_neighbors': 10}. Best is trial 134 with value: 0.3757565391314363.
[I 2022-10-23 23:11:59,326] Trial 297 finished with value: 0.3738958658531738 and parameters: {'algorithm': 'ball_tree', 'k_n_neighbors': 9}. Best is trial 134 with value: 0.3757565391314363.
[I 2022-10-23 23:12:20,975] Trial 298 finished with value: 0.3757565391314363 and parameters: {'algorithm': 'ball_tree', 'k_n_neighbors': 10}. Best is trial 134 with value: 0.3757565391314363.
[I 2022-10-23 23:12:42,141] Trial 299 finished with value: 0.3757565391314363 and parameters: {'algorithm': 'ball_tree', 'k_n_neighbors': 10}. Best is trial 134 with value: 0.3757565391314363.
[I 2022-10-23 23:13:05,351] Trial 300 finished with value: 0.3757565391314363 and parameters: {'algorithm': 'ball_tree', 'k_n_neighbors': 10}. Best is trial 134 with value: 0.3757565391314363.
[I 2022-10-23 23:13:28,837] Trial 301 finished with value: 0.3757565391314363 and parameters: {'algorithm': 'ball_tree', 'k_n_neighbors': 10}. Best is trial 134 with value: 0.3757565391314363.
[I 2022-10-23 23:13:52,003] Trial 302 finished with value: 0.3738958658531738 and parameters: {'algorithm': 'ball_tree', 'k_n_neighbors': 9}. Best is trial 134 with value: 0.3757565391314363.
[I 2022-10-23 23:14:29,772] Trial 303 finished with value: 0.3681824060059922 and parameters: {'algorithm': 'brute', 'k_n_neighbors': 7}. Best is trial 134 with value: 0.3757565391314363.
[I 2022-10-23 23:14:53,153] Trial 304 finished with value: 0.3757565391314363 and parameters: {'algorithm': 'ball_tree', 'k_n_neighbors': 10}. Best is trial 134 with value: 0.3757565391314363.
[I 2022-10-23 23:15:16,256] Trial 305 finished with value: 0.3757565391314363 and parameters: {'algorithm': 'ball_tree', 'k_n_neighbors': 10}. Best is trial 134 with value: 0.3757565391314363.
[I 2022-10-23 23:15:40,932] Trial 306 finished with value: 0.3738958658531738 and parameters: {'algorithm': 'ball_tree', 'k_n_neighbors': 9}. Best is trial 134 with value: 0.3757565391314363.
[I 2022-10-23 23:16:03,939] Trial 307 finished with value: 0.3757565391314363 and parameters: {'algorithm': 'ball_tree', 'k_n_neighbors': 10}. Best is trial 134 with value: 0.3757565391314363.
[I 2022-10-23 23:16:29,343] Trial 308 finished with value: 0.3757565391314363 and parameters: {'algorithm': 'ball_tree', 'k_n_neighbors': 10}. Best is trial 134 with value: 0.3757565391314363.
[I 2022-10-23 23:16:51,953] Trial 309 finished with value: 0.3757565391314363 and parameters: {'algorithm': 'ball_tree', 'k_n_neighbors': 10}. Best is trial 134 with value: 0.3757565391314363.
[I 2022-10-23 23:17:15,931] Trial 310 finished with value: 0.3757565391314363 and parameters: {'algorithm': 'ball_tree', 'k_n_neighbors': 10}. Best is trial 134 with value: 0.3757565391314363.
[I 2022-10-23 23:17:38,729] Trial 311 finished with value: 0.3738958658531738 and parameters: {'algorithm': 'ball_tree', 'k_n_neighbors': 9}. Best is trial 134 with value: 0.3757565391314363.
[I 2022-10-23 23:17:59,740] Trial 312 finished with value: 0.3738958658531738 and parameters: {'algorithm': 'ball_tree', 'k_n_neighbors': 9}. Best is trial 134 with value: 0.3757565391314363.
[I 2022-10-23 23:18:22,055] Trial 313 finished with value: 0.3757565391314363 and parameters: {'algorithm': 'ball_tree', 'k_n_neighbors': 10}. Best is trial 134 with value: 0.3757565391314363.
[I 2022-10-23 23:18:42,661] Trial 314 finished with value: 0.3647169874830416 and parameters: {'algorithm': 'ball_tree', 'k_n_neighbors': 6}. Best is trial 134 with value: 0.3757565391314363.
[I 2022-10-23 23:19:05,336] Trial 315 finished with value: 0.3757565391314363 and parameters: {'algorithm': 'ball_tree', 'k_n_neighbors': 10}. Best is trial 134 with value: 0.3757565391314363.
[I 2022-10-23 23:19:27,595] Trial 316 finished with value: 0.3757565391314363 and parameters: {'algorithm': 'ball_tree', 'k_n_neighbors': 10}. Best is trial 134 with value: 0.3757565391314363.
[I 2022-10-23 23:19:50,497] Trial 317 finished with value: 0.3757565391314363 and parameters: {'algorithm': 'ball_tree', 'k_n_neighbors': 10}. Best is trial 134 with value: 0.3757565391314363.
[I 2022-10-23 23:20:12,846] Trial 318 finished with value: 0.3738958658531738 and parameters: {'algorithm': 'ball_tree', 'k_n_neighbors': 9}. Best is trial 134 with value: 0.3757565391314363.
[I 2022-10-23 23:20:35,339] Trial 319 finished with value: 0.3757565391314363 and parameters: {'algorithm': 'ball_tree', 'k_n_neighbors': 10}. Best is trial 134 with value: 0.3757565391314363.
[I 2022-10-23 23:20:58,367] Trial 320 finished with value: 0.3757565391314363 and parameters: {'algorithm': 'ball_tree', 'k_n_neighbors': 10}. Best is trial 134 with value: 0.3757565391314363.
[I 2022-10-23 23:21:20,597] Trial 321 finished with value: 0.3738958658531738 and parameters: {'algorithm': 'ball_tree', 'k_n_neighbors': 9}. Best is trial 134 with value: 0.3757565391314363.
[I 2022-10-23 23:21:44,855] Trial 322 finished with value: 0.3757565391314363 and parameters: {'algorithm': 'ball_tree', 'k_n_neighbors': 10}. Best is trial 134 with value: 0.3757565391314363.
[I 2022-10-23 23:22:07,789] Trial 323 finished with value: 0.3757565391314363 and parameters: {'algorithm': 'ball_tree', 'k_n_neighbors': 10}. Best is trial 134 with value: 0.3757565391314363.
[I 2022-10-23 23:22:46,678] Trial 324 finished with value: 0.375718496832209 and parameters: {'algorithm': 'brute', 'k_n_neighbors': 10}. Best is trial 134 with value: 0.3757565391314363.
[I 2022-10-23 23:23:09,203] Trial 325 finished with value: 0.3738958658531738 and parameters: {'algorithm': 'ball_tree', 'k_n_neighbors': 9}. Best is trial 134 with value: 0.3757565391314363.
[I 2022-10-23 23:23:31,854] Trial 326 finished with value: 0.3757565391314363 and parameters: {'algorithm': 'ball_tree', 'k_n_neighbors': 10}. Best is trial 134 with value: 0.3757565391314363.
[I 2022-10-23 23:23:54,271] Trial 327 finished with value: 0.3757565391314363 and parameters: {'algorithm': 'ball_tree', 'k_n_neighbors': 10}. Best is trial 134 with value: 0.3757565391314363.
[I 2022-10-23 23:24:16,860] Trial 328 finished with value: 0.3757565391314363 and parameters: {'algorithm': 'ball_tree', 'k_n_neighbors': 10}. Best is trial 134 with value: 0.3757565391314363.
[I 2022-10-23 23:24:39,355] Trial 329 finished with value: 0.3757565391314363 and parameters: {'algorithm': 'ball_tree', 'k_n_neighbors': 10}. Best is trial 134 with value: 0.3757565391314363.
[I 2022-10-23 23:24:59,206] Trial 330 finished with value: 0.3400197775842936 and parameters: {'algorithm': 'ball_tree', 'k_n_neighbors': 3}. Best is trial 134 with value: 0.3757565391314363.
[I 2022-10-23 23:25:22,622] Trial 331 finished with value: 0.3757565391314363 and parameters: {'algorithm': 'ball_tree', 'k_n_neighbors': 10}. Best is trial 134 with value: 0.3757565391314363.
[I 2022-10-23 23:25:45,193] Trial 332 finished with value: 0.3738958658531738 and parameters: {'algorithm': 'ball_tree', 'k_n_neighbors': 9}. Best is trial 134 with value: 0.3757565391314363.
[I 2022-10-23 23:26:07,875] Trial 333 finished with value: 0.3757565391314363 and parameters: {'algorithm': 'ball_tree', 'k_n_neighbors': 10}. Best is trial 134 with value: 0.3757565391314363.
[I 2022-10-23 23:26:30,393] Trial 334 finished with value: 0.3738958658531738 and parameters: {'algorithm': 'ball_tree', 'k_n_neighbors': 9}. Best is trial 134 with value: 0.3757565391314363.
[I 2022-10-23 23:26:52,900] Trial 335 finished with value: 0.3757565391314363 and parameters: {'algorithm': 'ball_tree', 'k_n_neighbors': 10}. Best is trial 134 with value: 0.3757565391314363.
[I 2022-10-23 23:27:15,667] Trial 336 finished with value: 0.3757565391314363 and parameters: {'algorithm': 'ball_tree', 'k_n_neighbors': 10}. Best is trial 134 with value: 0.3757565391314363.
[I 2022-10-23 23:27:38,579] Trial 337 finished with value: 0.3757565391314363 and parameters: {'algorithm': 'ball_tree', 'k_n_neighbors': 10}. Best is trial 134 with value: 0.3757565391314363.
[I 2022-10-23 23:28:01,944] Trial 338 finished with value: 0.3757565391314363 and parameters: {'algorithm': 'ball_tree', 'k_n_neighbors': 10}. Best is trial 134 with value: 0.3757565391314363.
[I 2022-10-23 23:28:24,707] Trial 339 finished with value: 0.3738958658531738 and parameters: {'algorithm': 'ball_tree', 'k_n_neighbors': 9}. Best is trial 134 with value: 0.3757565391314363.
[I 2022-10-23 23:28:46,948] Trial 340 finished with value: 0.3757565391314363 and parameters: {'algorithm': 'ball_tree', 'k_n_neighbors': 10}. Best is trial 134 with value: 0.3757565391314363.
