[I 2022-10-24 00:55:00,394] Trial 569 finished with value: 0.3757565391314363 and parameters: {'algorithm': 'ball_tree', 'k_n_neighbors': 10}. Best is trial 134 with value: 0.3757565391314363.
[I 2022-10-24 00:55:23,633] Trial 570 finished with value: 0.3757565391314363 and parameters: {'algorithm': 'ball_tree', 'k_n_neighbors': 10}. Best is trial 134 with value: 0.3757565391314363.
[I 2022-10-24 00:55:46,976] Trial 571 finished with value: 0.3757565391314363 and parameters: {'algorithm': 'ball_tree', 'k_n_neighbors': 10}. Best is trial 134 with value: 0.3757565391314363.
[I 2022-10-24 00:56:09,725] Trial 572 finished with value: 0.3738958658531738 and parameters: {'algorithm': 'ball_tree', 'k_n_neighbors': 9}. Best is trial 134 with value: 0.3757565391314363.
[I 2022-10-24 00:56:32,853] Trial 573 finished with value: 0.3757565391314363 and parameters: {'algorithm': 'ball_tree', 'k_n_neighbors': 10}. Best is trial 134 with value: 0.3757565391314363.
[I 2022-10-24 00:56:45,571] Trial 574 finished with value: 0.37572195506537703 and parameters: {'algorithm': 'kd_tree', 'k_n_neighbors': 10}. Best is trial 134 with value: 0.3757565391314363.
[I 2022-10-24 00:57:08,497] Trial 575 finished with value: 0.3738958658531738 and parameters: {'algorithm': 'ball_tree', 'k_n_neighbors': 9}. Best is trial 134 with value: 0.3757565391314363.
[I 2022-10-24 00:57:31,966] Trial 576 finished with value: 0.3757565391314363 and parameters: {'algorithm': 'ball_tree', 'k_n_neighbors': 10}. Best is trial 134 with value: 0.3757565391314363.
[I 2022-10-24 00:57:55,268] Trial 577 finished with value: 0.3757565391314363 and parameters: {'algorithm': 'ball_tree', 'k_n_neighbors': 10}. Best is trial 134 with value: 0.3757565391314363.
[I 2022-10-24 00:58:18,389] Trial 578 finished with value: 0.3757565391314363 and parameters: {'algorithm': 'ball_tree', 'k_n_neighbors': 10}. Best is trial 134 with value: 0.3757565391314363.
[I 2022-10-24 00:58:41,074] Trial 579 finished with value: 0.3738958658531738 and parameters: {'algorithm': 'ball_tree', 'k_n_neighbors': 9}. Best is trial 134 with value: 0.3757565391314363.
[I 2022-10-24 00:59:04,473] Trial 580 finished with value: 0.3757565391314363 and parameters: {'algorithm': 'ball_tree', 'k_n_neighbors': 10}. Best is trial 134 with value: 0.3757565391314363.
[I 2022-10-24 00:59:27,515] Trial 581 finished with value: 0.3757565391314363 and parameters: {'algorithm': 'ball_tree', 'k_n_neighbors': 10}. Best is trial 134 with value: 0.3757565391314363.
[I 2022-10-24 00:59:50,496] Trial 582 finished with value: 0.3757565391314363 and parameters: {'algorithm': 'ball_tree', 'k_n_neighbors': 10}. Best is trial 134 with value: 0.3757565391314363.
[I 2022-10-24 01:00:13,198] Trial 583 finished with value: 0.3738958658531738 and parameters: {'algorithm': 'ball_tree', 'k_n_neighbors': 9}. Best is trial 134 with value: 0.3757565391314363.
[I 2022-10-24 01:00:50,758] Trial 584 finished with value: 0.3738370721813343 and parameters: {'algorithm': 'brute', 'k_n_neighbors': 9}. Best is trial 134 with value: 0.3757565391314363.
[I 2022-10-24 01:01:13,723] Trial 585 finished with value: 0.3757565391314363 and parameters: {'algorithm': 'ball_tree', 'k_n_neighbors': 10}. Best is trial 134 with value: 0.3757565391314363.
[I 2022-10-24 01:01:36,500] Trial 586 finished with value: 0.3757565391314363 and parameters: {'algorithm': 'ball_tree', 'k_n_neighbors': 10}. Best is trial 134 with value: 0.3757565391314363.
[I 2022-10-24 01:01:59,474] Trial 587 finished with value: 0.3757565391314363 and parameters: {'algorithm': 'ball_tree', 'k_n_neighbors': 10}. Best is trial 134 with value: 0.3757565391314363.
[I 2022-10-24 01:02:12,199] Trial 588 finished with value: 0.37572195506537703 and parameters: {'algorithm': 'auto', 'k_n_neighbors': 10}. Best is trial 134 with value: 0.3757565391314363.
[I 2022-10-24 01:02:34,915] Trial 589 finished with value: 0.3738958658531738 and parameters: {'algorithm': 'ball_tree', 'k_n_neighbors': 9}. Best is trial 134 with value: 0.3757565391314363.
[I 2022-10-24 01:02:57,747] Trial 590 finished with value: 0.3757565391314363 and parameters: {'algorithm': 'ball_tree', 'k_n_neighbors': 10}. Best is trial 134 with value: 0.3757565391314363.
[I 2022-10-24 01:03:20,824] Trial 591 finished with value: 0.3757565391314363 and parameters: {'algorithm': 'ball_tree', 'k_n_neighbors': 10}. Best is trial 134 with value: 0.3757565391314363.
[I 2022-10-24 01:03:43,765] Trial 592 finished with value: 0.3757565391314363 and parameters: {'algorithm': 'ball_tree', 'k_n_neighbors': 10}. Best is trial 134 with value: 0.3757565391314363.
[I 2022-10-24 01:04:06,653] Trial 593 finished with value: 0.3757565391314363 and parameters: {'algorithm': 'ball_tree', 'k_n_neighbors': 10}. Best is trial 134 with value: 0.3757565391314363.
[I 2022-10-24 01:04:29,762] Trial 594 finished with value: 0.3757565391314363 and parameters: {'algorithm': 'ball_tree', 'k_n_neighbors': 10}. Best is trial 134 with value: 0.3757565391314363.
[I 2022-10-24 01:04:52,642] Trial 595 finished with value: 0.3757565391314363 and parameters: {'algorithm': 'ball_tree', 'k_n_neighbors': 10}. Best is trial 134 with value: 0.3757565391314363.
[I 2022-10-24 01:05:15,268] Trial 596 finished with value: 0.3738958658531738 and parameters: {'algorithm': 'ball_tree', 'k_n_neighbors': 9}. Best is trial 134 with value: 0.3757565391314363.
[I 2022-10-24 01:05:38,405] Trial 597 finished with value: 0.3757565391314363 and parameters: {'algorithm': 'ball_tree', 'k_n_neighbors': 10}. Best is trial 134 with value: 0.3757565391314363.
[I 2022-10-24 01:06:01,331] Trial 598 finished with value: 0.3757565391314363 and parameters: {'algorithm': 'ball_tree', 'k_n_neighbors': 10}. Best is trial 134 with value: 0.3757565391314363.
[I 2022-10-24 01:06:23,661] Trial 599 finished with value: 0.3738958658531738 and parameters: {'algorithm': 'ball_tree', 'k_n_neighbors': 9}. Best is trial 134 with value: 0.3757565391314363.
Number of finished trials:  600
Best trial:
  Value: 0.3757565391314363
  Params:
    algorithm: ball_tree
    k_n_neighbors: 10

Process finished with exit code 0

