S:\repositories\Teaching\flightsML\venv\Scripts\python.exe S:\repositories\Teaching\flightsML\flights_arrival_time_prediction\flights_arrival_time_prediction.py
Columns (77,84) have mixed types. Specify dtype option on import or set low_memory=False.
Default parameter min_samples_leaf will change in version 2.6.See https://github.com/scikit-learn-contrib/category_encoders/issues/327
Default parameter smoothing will change in version 2.6.See https://github.com/scikit-learn-contrib/category_encoders/issues/327
[I 2022-10-23 21:33:07,477] A new study created in memory with name: no-name-4e2c401c-8a6a-49e9-a71c-327e9d1b0252
KNeighborsClassifier
[I 2022-10-23 21:33:26,581] Trial 0 finished with value: 0.34783600682734556 and parameters: {'algorithm': 'ball_tree', 'k_n_neighbors': 4}. Best is trial 0 with value: 0.34783600682734556.
[I 2022-10-23 21:33:37,542] Trial 1 finished with value: 0.3395355882197751 and parameters: {'algorithm': 'kd_tree', 'k_n_neighbors': 2}. Best is trial 0 with value: 0.34783600682734556.
[I 2022-10-23 21:34:13,507] Trial 2 finished with value: 0.3479605132090267 and parameters: {'algorithm': 'brute', 'k_n_neighbors': 4}. Best is trial 2 with value: 0.3479605132090267.
[I 2022-10-23 21:34:48,723] Trial 3 finished with value: 0.3395943833269632 and parameters: {'algorithm': 'brute', 'k_n_neighbors': 2}. Best is trial 2 with value: 0.3479605132090267.
[I 2022-10-23 21:35:08,072] Trial 4 finished with value: 0.3570978929605617 and parameters: {'algorithm': 'ball_tree', 'k_n_neighbors': 5}. Best is trial 4 with value: 0.3570978929605617.
[I 2022-10-23 21:35:19,564] Trial 5 finished with value: 0.3647204454171786 and parameters: {'algorithm': 'auto', 'k_n_neighbors': 6}. Best is trial 5 with value: 0.3647204454171786.
[I 2022-10-23 21:35:31,161] Trial 6 finished with value: 0.37395466102016806 and parameters: {'algorithm': 'kd_tree', 'k_n_neighbors': 9}. Best is trial 6 with value: 0.37395466102016806.
[I 2022-10-23 21:36:07,063] Trial 7 finished with value: 0.3738370721813343 and parameters: {'algorithm': 'brute', 'k_n_neighbors': 9}. Best is trial 6 with value: 0.37395466102016806.
[I 2022-10-23 21:36:25,665] Trial 8 finished with value: 0.3395494223485709 and parameters: {'algorithm': 'ball_tree', 'k_n_neighbors': 2}. Best is trial 6 with value: 0.37395466102016806.
[I 2022-10-23 21:36:36,874] Trial 9 finished with value: 0.3479017182812572 and parameters: {'algorithm': 'kd_tree', 'k_n_neighbors': 4}. Best is trial 6 with value: 0.37395466102016806.
[I 2022-10-23 21:36:48,464] Trial 10 finished with value: 0.37395466102016806 and parameters: {'algorithm': 'kd_tree', 'k_n_neighbors': 9}. Best is trial 6 with value: 0.37395466102016806.
[I 2022-10-23 21:37:00,207] Trial 11 finished with value: 0.37572195506537703 and parameters: {'algorithm': 'kd_tree', 'k_n_neighbors': 10}. Best is trial 11 with value: 0.37572195506537703.
[I 2022-10-23 21:37:11,856] Trial 12 finished with value: 0.37572195506537703 and parameters: {'algorithm': 'kd_tree', 'k_n_neighbors': 10}. Best is trial 11 with value: 0.37572195506537703.
[I 2022-10-23 21:37:23,319] Trial 13 finished with value: 0.3682031574384106 and parameters: {'algorithm': 'kd_tree', 'k_n_neighbors': 7}. Best is trial 11 with value: 0.37572195506537703.
[I 2022-10-23 21:37:35,189] Trial 14 finished with value: 0.37572195506537703 and parameters: {'algorithm': 'auto', 'k_n_neighbors': 10}. Best is trial 11 with value: 0.37572195506537703.
[I 2022-10-23 21:37:46,581] Trial 15 finished with value: 0.3682031574384106 and parameters: {'algorithm': 'kd_tree', 'k_n_neighbors': 7}. Best is trial 11 with value: 0.37572195506537703.
[I 2022-10-23 21:37:57,766] Trial 16 finished with value: 0.3398503106428635 and parameters: {'algorithm': 'kd_tree', 'k_n_neighbors': 3}. Best is trial 11 with value: 0.37572195506537703.
[I 2022-10-23 21:38:08,928] Trial 17 finished with value: 0.3398503106428635 and parameters: {'algorithm': 'auto', 'k_n_neighbors': 3}. Best is trial 11 with value: 0.37572195506537703.
[I 2022-10-23 21:38:20,399] Trial 18 finished with value: 0.3682031574384106 and parameters: {'algorithm': 'auto', 'k_n_neighbors': 7}. Best is trial 11 with value: 0.37572195506537703.
[I 2022-10-23 21:38:31,573] Trial 19 finished with value: 0.35700105381976677 and parameters: {'algorithm': 'auto', 'k_n_neighbors': 5}. Best is trial 11 with value: 0.37572195506537703.
[I 2022-10-23 21:38:43,497] Trial 20 finished with value: 0.37572195506537703 and parameters: {'algorithm': 'auto', 'k_n_neighbors': 10}. Best is trial 11 with value: 0.37572195506537703.
[I 2022-10-23 21:38:55,241] Trial 21 finished with value: 0.37572195506537703 and parameters: {'algorithm': 'auto', 'k_n_neighbors': 10}. Best is trial 11 with value: 0.37572195506537703.
[I 2022-10-23 21:39:06,755] Trial 22 finished with value: 0.3710564316705965 and parameters: {'algorithm': 'auto', 'k_n_neighbors': 8}. Best is trial 11 with value: 0.37572195506537703.
[I 2022-10-23 21:39:18,081] Trial 23 finished with value: 0.3647204454171786 and parameters: {'algorithm': 'auto', 'k_n_neighbors': 6}. Best is trial 11 with value: 0.37572195506537703.
[I 2022-10-23 21:39:29,699] Trial 24 finished with value: 0.3710564316705965 and parameters: {'algorithm': 'auto', 'k_n_neighbors': 8}. Best is trial 11 with value: 0.37572195506537703.
[I 2022-10-23 21:39:41,504] Trial 25 finished with value: 0.37572195506537703 and parameters: {'algorithm': 'auto', 'k_n_neighbors': 10}. Best is trial 11 with value: 0.37572195506537703.
[I 2022-10-23 21:39:53,065] Trial 26 finished with value: 0.3710564316705965 and parameters: {'algorithm': 'auto', 'k_n_neighbors': 8}. Best is trial 11 with value: 0.37572195506537703.
[I 2022-10-23 21:40:04,582] Trial 27 finished with value: 0.3647204454171786 and parameters: {'algorithm': 'auto', 'k_n_neighbors': 6}. Best is trial 11 with value: 0.37572195506537703.
[I 2022-10-23 21:40:15,780] Trial 28 finished with value: 0.35700105381976677 and parameters: {'algorithm': 'auto', 'k_n_neighbors': 5}. Best is trial 11 with value: 0.37572195506537703.
[I 2022-10-23 21:40:34,516] Trial 29 finished with value: 0.3400197775842936 and parameters: {'algorithm': 'ball_tree', 'k_n_neighbors': 3}. Best is trial 11 with value: 0.37572195506537703.
[I 2022-10-23 21:41:10,888] Trial 30 finished with value: 0.3709250090618041 and parameters: {'algorithm': 'brute', 'k_n_neighbors': 8}. Best is trial 11 with value: 0.37572195506537703.
[I 2022-10-23 21:41:22,586] Trial 31 finished with value: 0.37572195506537703 and parameters: {'algorithm': 'auto', 'k_n_neighbors': 10}. Best is trial 11 with value: 0.37572195506537703.
[I 2022-10-23 21:41:34,292] Trial 32 finished with value: 0.37572195506537703 and parameters: {'algorithm': 'auto', 'k_n_neighbors': 10}. Best is trial 11 with value: 0.37572195506537703.
[I 2022-10-23 21:41:45,923] Trial 33 finished with value: 0.37395466102016806 and parameters: {'algorithm': 'auto', 'k_n_neighbors': 9}. Best is trial 11 with value: 0.37572195506537703.
[I 2022-10-23 21:41:57,433] Trial 34 finished with value: 0.3682031574384106 and parameters: {'algorithm': 'auto', 'k_n_neighbors': 7}. Best is trial 11 with value: 0.37572195506537703.
[I 2022-10-23 21:42:09,025] Trial 35 finished with value: 0.37395466102016806 and parameters: {'algorithm': 'auto', 'k_n_neighbors': 9}. Best is trial 11 with value: 0.37572195506537703.
[I 2022-10-23 21:42:20,462] Trial 36 finished with value: 0.3710564316705965 and parameters: {'algorithm': 'auto', 'k_n_neighbors': 8}. Best is trial 11 with value: 0.37572195506537703.
[I 2022-10-23 21:42:57,077] Trial 37 finished with value: 0.375718496832209 and parameters: {'algorithm': 'brute', 'k_n_neighbors': 10}. Best is trial 11 with value: 0.37572195506537703.
[I 2022-10-23 21:43:08,492] Trial 38 finished with value: 0.3647204454171786 and parameters: {'algorithm': 'auto', 'k_n_neighbors': 6}. Best is trial 11 with value: 0.37572195506537703.
[I 2022-10-23 21:43:30,950] Trial 39 finished with value: 0.3738958658531738 and parameters: {'algorithm': 'ball_tree', 'k_n_neighbors': 9}. Best is trial 11 with value: 0.37572195506537703.
[I 2022-10-23 21:43:42,997] Trial 40 finished with value: 0.3682031574384106 and parameters: {'algorithm': 'auto', 'k_n_neighbors': 7}. Best is trial 11 with value: 0.37572195506537703.
[I 2022-10-23 21:43:55,249] Trial 41 finished with value: 0.37572195506537703 and parameters: {'algorithm': 'kd_tree', 'k_n_neighbors': 10}. Best is trial 11 with value: 0.37572195506537703.
[I 2022-10-23 21:44:07,645] Trial 42 finished with value: 0.37395466102016806 and parameters: {'algorithm': 'auto', 'k_n_neighbors': 9}. Best is trial 11 with value: 0.37572195506537703.
[I 2022-10-23 21:44:44,566] Trial 43 finished with value: 0.375718496832209 and parameters: {'algorithm': 'brute', 'k_n_neighbors': 10}. Best is trial 11 with value: 0.37572195506537703.
[I 2022-10-23 21:45:06,982] Trial 44 finished with value: 0.3710391400861132 and parameters: {'algorithm': 'ball_tree', 'k_n_neighbors': 8}. Best is trial 11 with value: 0.37572195506537703.
[I 2022-10-23 21:45:19,319] Trial 45 finished with value: 0.37395466102016806 and parameters: {'algorithm': 'kd_tree', 'k_n_neighbors': 9}. Best is trial 11 with value: 0.37572195506537703.
[I 2022-10-23 21:45:31,532] Trial 46 finished with value: 0.37572195506537703 and parameters: {'algorithm': 'kd_tree', 'k_n_neighbors': 10}. Best is trial 11 with value: 0.37572195506537703.
[I 2022-10-23 21:45:43,668] Trial 47 finished with value: 0.37395466102016806 and parameters: {'algorithm': 'auto', 'k_n_neighbors': 9}. Best is trial 11 with value: 0.37572195506537703.
[I 2022-10-23 21:45:55,918] Trial 48 finished with value: 0.37572195506537703 and parameters: {'algorithm': 'kd_tree', 'k_n_neighbors': 10}. Best is trial 11 with value: 0.37572195506537703.
[I 2022-10-23 21:46:32,780] Trial 49 finished with value: 0.3709250090618041 and parameters: {'algorithm': 'brute', 'k_n_neighbors': 8}. Best is trial 11 with value: 0.37572195506537703.
[I 2022-10-23 21:46:52,227] Trial 50 finished with value: 0.3395494223485709 and parameters: {'algorithm': 'ball_tree', 'k_n_neighbors': 2}. Best is trial 11 with value: 0.37572195506537703.
[I 2022-10-23 21:47:04,565] Trial 51 finished with value: 0.37572195506537703 and parameters: {'algorithm': 'auto', 'k_n_neighbors': 10}. Best is trial 11 with value: 0.37572195506537703.
[I 2022-10-23 21:47:16,768] Trial 52 finished with value: 0.37395466102016806 and parameters: {'algorithm': 'kd_tree', 'k_n_neighbors': 9}. Best is trial 11 with value: 0.37572195506537703.
[I 2022-10-23 21:47:29,287] Trial 53 finished with value: 0.37572195506537703 and parameters: {'algorithm': 'auto', 'k_n_neighbors': 10}. Best is trial 11 with value: 0.37572195506537703.
[I 2022-10-23 21:47:41,518] Trial 54 finished with value: 0.37395466102016806 and parameters: {'algorithm': 'auto', 'k_n_neighbors': 9}. Best is trial 11 with value: 0.37572195506537703.
[I 2022-10-23 21:47:53,509] Trial 55 finished with value: 0.3682031574384106 and parameters: {'algorithm': 'kd_tree', 'k_n_neighbors': 7}. Best is trial 11 with value: 0.37572195506537703.
[I 2022-10-23 21:48:05,372] Trial 56 finished with value: 0.35700105381976677 and parameters: {'algorithm': 'kd_tree', 'k_n_neighbors': 5}. Best is trial 11 with value: 0.37572195506537703.
[I 2022-10-23 21:48:17,228] Trial 57 finished with value: 0.3710564316705965 and parameters: {'algorithm': 'kd_tree', 'k_n_neighbors': 8}. Best is trial 11 with value: 0.37572195506537703.
[I 2022-10-23 21:48:29,007] Trial 58 finished with value: 0.37572195506537703 and parameters: {'algorithm': 'kd_tree', 'k_n_neighbors': 10}. Best is trial 11 with value: 0.37572195506537703.
[I 2022-10-23 21:48:40,694] Trial 59 finished with value: 0.37572195506537703 and parameters: {'algorithm': 'kd_tree', 'k_n_neighbors': 10}. Best is trial 11 with value: 0.37572195506537703.
[I 2022-10-23 21:48:52,365] Trial 60 finished with value: 0.37572195506537703 and parameters: {'algorithm': 'kd_tree', 'k_n_neighbors': 10}. Best is trial 11 with value: 0.37572195506537703.
[I 2022-10-23 21:49:04,045] Trial 61 finished with value: 0.37395466102016806 and parameters: {'algorithm': 'kd_tree', 'k_n_neighbors': 9}. Best is trial 11 with value: 0.37572195506537703.
[I 2022-10-23 21:49:15,614] Trial 62 finished with value: 0.3710564316705965 and parameters: {'algorithm': 'kd_tree', 'k_n_neighbors': 8}. Best is trial 11 with value: 0.37572195506537703.
[I 2022-10-23 21:49:27,305] Trial 63 finished with value: 0.37572195506537703 and parameters: {'algorithm': 'auto', 'k_n_neighbors': 10}. Best is trial 11 with value: 0.37572195506537703.
[I 2022-10-23 21:49:39,101] Trial 64 finished with value: 0.37572195506537703 and parameters: {'algorithm': 'kd_tree', 'k_n_neighbors': 10}. Best is trial 11 with value: 0.37572195506537703.
[I 2022-10-23 21:49:50,867] Trial 65 finished with value: 0.37572195506537703 and parameters: {'algorithm': 'kd_tree', 'k_n_neighbors': 10}. Best is trial 11 with value: 0.37572195506537703.
[I 2022-10-23 21:50:02,452] Trial 66 finished with value: 0.37395466102016806 and parameters: {'algorithm': 'kd_tree', 'k_n_neighbors': 9}. Best is trial 11 with value: 0.37572195506537703.
[I 2022-10-23 21:50:14,029] Trial 67 finished with value: 0.37395466102016806 and parameters: {'algorithm': 'auto', 'k_n_neighbors': 9}. Best is trial 11 with value: 0.37572195506537703.
[I 2022-10-23 21:50:25,393] Trial 68 finished with value: 0.3682031574384106 and parameters: {'algorithm': 'auto', 'k_n_neighbors': 7}. Best is trial 11 with value: 0.37572195506537703.
[I 2022-10-23 21:50:36,462] Trial 69 finished with value: 0.3479017182812572 and parameters: {'algorithm': 'auto', 'k_n_neighbors': 4}. Best is trial 11 with value: 0.37572195506537703.
[I 2022-10-23 21:50:48,150] Trial 70 finished with value: 0.3710564316705965 and parameters: {'algorithm': 'auto', 'k_n_neighbors': 8}. Best is trial 11 with value: 0.37572195506537703.
[I 2022-10-23 21:50:59,660] Trial 71 finished with value: 0.37395466102016806 and parameters: {'algorithm': 'kd_tree', 'k_n_neighbors': 9}. Best is trial 11 with value: 0.37572195506537703.
[I 2022-10-23 21:51:11,276] Trial 72 finished with value: 0.37572195506537703 and parameters: {'algorithm': 'auto', 'k_n_neighbors': 10}. Best is trial 11 with value: 0.37572195506537703.
[I 2022-10-23 21:51:22,784] Trial 73 finished with value: 0.37572195506537703 and parameters: {'algorithm': 'auto', 'k_n_neighbors': 10}. Best is trial 11 with value: 0.37572195506537703.
[I 2022-10-23 21:51:34,385] Trial 74 finished with value: 0.37572195506537703 and parameters: {'algorithm': 'auto', 'k_n_neighbors': 10}. Best is trial 11 with value: 0.37572195506537703.
[I 2022-10-23 21:51:46,100] Trial 75 finished with value: 0.37395466102016806 and parameters: {'algorithm': 'auto', 'k_n_neighbors': 9}. Best is trial 11 with value: 0.37572195506537703.
[I 2022-10-23 21:52:22,527] Trial 76 finished with value: 0.3709250090618041 and parameters: {'algorithm': 'brute', 'k_n_neighbors': 8}. Best is trial 11 with value: 0.37572195506537703.
[I 2022-10-23 21:52:35,006] Trial 77 finished with value: 0.37572195506537703 and parameters: {'algorithm': 'kd_tree', 'k_n_neighbors': 10}. Best is trial 11 with value: 0.37572195506537703.
[I 2022-10-23 21:52:47,403] Trial 78 finished with value: 0.37572195506537703 and parameters: {'algorithm': 'kd_tree', 'k_n_neighbors': 10}. Best is trial 11 with value: 0.37572195506537703.
[I 2022-10-23 21:53:10,187] Trial 79 finished with value: 0.3738958658531738 and parameters: {'algorithm': 'ball_tree', 'k_n_neighbors': 9}. Best is trial 11 with value: 0.37572195506537703.
[I 2022-10-23 21:53:22,582] Trial 80 finished with value: 0.37395466102016806 and parameters: {'algorithm': 'auto', 'k_n_neighbors': 9}. Best is trial 11 with value: 0.37572195506537703.
[I 2022-10-23 21:53:34,974] Trial 81 finished with value: 0.37572195506537703 and parameters: {'algorithm': 'kd_tree', 'k_n_neighbors': 10}. Best is trial 11 with value: 0.37572195506537703.
[I 2022-10-23 21:53:47,391] Trial 82 finished with value: 0.37572195506537703 and parameters: {'algorithm': 'kd_tree', 'k_n_neighbors': 10}. Best is trial 11 with value: 0.37572195506537703.
[I 2022-10-23 21:53:59,812] Trial 83 finished with value: 0.37572195506537703 and parameters: {'algorithm': 'kd_tree', 'k_n_neighbors': 10}. Best is trial 11 with value: 0.37572195506537703.
[I 2022-10-23 21:54:12,175] Trial 84 finished with value: 0.37572195506537703 and parameters: {'algorithm': 'kd_tree', 'k_n_neighbors': 10}. Best is trial 11 with value: 0.37572195506537703.
[I 2022-10-23 21:54:24,368] Trial 85 finished with value: 0.3710564316705965 and parameters: {'algorithm': 'auto', 'k_n_neighbors': 8}. Best is trial 11 with value: 0.37572195506537703.
[I 2022-10-23 21:54:36,590] Trial 86 finished with value: 0.37395466102016806 and parameters: {'algorithm': 'auto', 'k_n_neighbors': 9}. Best is trial 11 with value: 0.37572195506537703.
[I 2022-10-23 21:54:48,401] Trial 87 finished with value: 0.3398503106428635 and parameters: {'algorithm': 'auto', 'k_n_neighbors': 3}. Best is trial 11 with value: 0.37572195506537703.
[I 2022-10-23 21:55:00,697] Trial 88 finished with value: 0.37395466102016806 and parameters: {'algorithm': 'kd_tree', 'k_n_neighbors': 9}. Best is trial 11 with value: 0.37572195506537703.
[I 2022-10-23 21:55:13,393] Trial 89 finished with value: 0.37572195506537703 and parameters: {'algorithm': 'auto', 'k_n_neighbors': 10}. Best is trial 11 with value: 0.37572195506537703.
[I 2022-10-23 21:55:25,726] Trial 90 finished with value: 0.37395466102016806 and parameters: {'algorithm': 'auto', 'k_n_neighbors': 9}. Best is trial 11 with value: 0.37572195506537703.
[I 2022-10-23 21:55:38,051] Trial 91 finished with value: 0.37572195506537703 and parameters: {'algorithm': 'auto', 'k_n_neighbors': 10}. Best is trial 11 with value: 0.37572195506537703.
[I 2022-10-23 21:55:50,446] Trial 92 finished with value: 0.37572195506537703 and parameters: {'algorithm': 'kd_tree', 'k_n_neighbors': 10}. Best is trial 11 with value: 0.37572195506537703.
[I 2022-10-23 21:56:02,857] Trial 93 finished with value: 0.37572195506537703 and parameters: {'algorithm': 'kd_tree', 'k_n_neighbors': 10}. Best is trial 11 with value: 0.37572195506537703.
[I 2022-10-23 21:56:15,464] Trial 94 finished with value: 0.37572195506537703 and parameters: {'algorithm': 'kd_tree', 'k_n_neighbors': 10}. Best is trial 11 with value: 0.37572195506537703.
[I 2022-10-23 21:56:27,562] Trial 95 finished with value: 0.3710564316705965 and parameters: {'algorithm': 'kd_tree', 'k_n_neighbors': 8}. Best is trial 11 with value: 0.37572195506537703.
[I 2022-10-23 21:56:39,867] Trial 96 finished with value: 0.37395466102016806 and parameters: {'algorithm': 'auto', 'k_n_neighbors': 9}. Best is trial 11 with value: 0.37572195506537703.
[I 2022-10-23 21:56:52,206] Trial 97 finished with value: 0.37395466102016806 and parameters: {'algorithm': 'auto', 'k_n_neighbors': 9}. Best is trial 11 with value: 0.37572195506537703.
[I 2022-10-23 21:57:04,490] Trial 98 finished with value: 0.3710564316705965 and parameters: {'algorithm': 'auto', 'k_n_neighbors': 8}. Best is trial 11 with value: 0.37572195506537703.
[I 2022-10-23 21:57:17,377] Trial 99 finished with value: 0.37572195506537703 and parameters: {'algorithm': 'kd_tree', 'k_n_neighbors': 10}. Best is trial 11 with value: 0.37572195506537703.
[I 2022-10-23 21:57:54,639] Trial 100 finished with value: 0.375718496832209 and parameters: {'algorithm': 'brute', 'k_n_neighbors': 10}. Best is trial 11 with value: 0.37572195506537703.
[I 2022-10-23 21:58:17,411] Trial 101 finished with value: 0.3738958658531738 and parameters: {'algorithm': 'ball_tree', 'k_n_neighbors': 9}. Best is trial 11 with value: 0.37572195506537703.
[I 2022-10-23 21:58:30,182] Trial 102 finished with value: 0.37572195506537703 and parameters: {'algorithm': 'kd_tree', 'k_n_neighbors': 10}. Best is trial 11 with value: 0.37572195506537703.
[I 2022-10-23 21:58:42,525] Trial 103 finished with value: 0.37572195506537703 and parameters: {'algorithm': 'kd_tree', 'k_n_neighbors': 10}. Best is trial 11 with value: 0.37572195506537703.
[I 2022-10-23 21:58:54,778] Trial 104 finished with value: 0.37395466102016806 and parameters: {'algorithm': 'kd_tree', 'k_n_neighbors': 9}. Best is trial 11 with value: 0.37572195506537703.
[I 2022-10-23 21:59:08,913] Trial 105 finished with value: 0.37572195506537703 and parameters: {'algorithm': 'auto', 'k_n_neighbors': 10}. Best is trial 11 with value: 0.37572195506537703.
[I 2022-10-23 21:59:21,319] Trial 106 finished with value: 0.37572195506537703 and parameters: {'algorithm': 'auto', 'k_n_neighbors': 10}. Best is trial 11 with value: 0.37572195506537703.
[I 2022-10-23 21:59:33,839] Trial 107 finished with value: 0.37395466102016806 and parameters: {'algorithm': 'kd_tree', 'k_n_neighbors': 9}. Best is trial 11 with value: 0.37572195506537703.
[I 2022-10-23 21:59:45,885] Trial 108 finished with value: 0.35700105381976677 and parameters: {'algorithm': 'auto', 'k_n_neighbors': 5}. Best is trial 11 with value: 0.37572195506537703.
[I 2022-10-23 21:59:58,375] Trial 109 finished with value: 0.37572195506537703 and parameters: {'algorithm': 'kd_tree', 'k_n_neighbors': 10}. Best is trial 11 with value: 0.37572195506537703.
[I 2022-10-23 22:00:10,814] Trial 110 finished with value: 0.37572195506537703 and parameters: {'algorithm': 'auto', 'k_n_neighbors': 10}. Best is trial 11 with value: 0.37572195506537703.
[I 2022-10-23 22:00:23,181] Trial 111 finished with value: 0.37572195506537703 and parameters: {'algorithm': 'auto', 'k_n_neighbors': 10}. Best is trial 11 with value: 0.37572195506537703.
[I 2022-10-23 22:00:35,516] Trial 112 finished with value: 0.37395466102016806 and parameters: {'algorithm': 'auto', 'k_n_neighbors': 9}. Best is trial 11 with value: 0.37572195506537703.
