[I 2022-10-24 00:12:48,834] Trial 455 finished with value: 0.3757565391314363 and parameters: {'algorithm': 'ball_tree', 'k_n_neighbors': 10}. Best is trial 134 with value: 0.3757565391314363.
[I 2022-10-24 00:13:11,528] Trial 456 finished with value: 0.3738958658531738 and parameters: {'algorithm': 'ball_tree', 'k_n_neighbors': 9}. Best is trial 134 with value: 0.3757565391314363.
[I 2022-10-24 00:13:34,747] Trial 457 finished with value: 0.3757565391314363 and parameters: {'algorithm': 'ball_tree', 'k_n_neighbors': 10}. Best is trial 134 with value: 0.3757565391314363.
[I 2022-10-24 00:13:57,232] Trial 458 finished with value: 0.3710391400861132 and parameters: {'algorithm': 'ball_tree', 'k_n_neighbors': 8}. Best is trial 134 with value: 0.3757565391314363.
[I 2022-10-24 00:14:18,738] Trial 459 finished with value: 0.3647169874830416 and parameters: {'algorithm': 'ball_tree', 'k_n_neighbors': 6}. Best is trial 134 with value: 0.3757565391314363.
[I 2022-10-24 00:14:42,003] Trial 460 finished with value: 0.3757565391314363 and parameters: {'algorithm': 'ball_tree', 'k_n_neighbors': 10}. Best is trial 134 with value: 0.3757565391314363.
[I 2022-10-24 00:15:05,554] Trial 461 finished with value: 0.3757565391314363 and parameters: {'algorithm': 'ball_tree', 'k_n_neighbors': 10}. Best is trial 134 with value: 0.3757565391314363.
[I 2022-10-24 00:15:44,026] Trial 462 finished with value: 0.3738370721813343 and parameters: {'algorithm': 'brute', 'k_n_neighbors': 9}. Best is trial 134 with value: 0.3757565391314363.
[I 2022-10-24 00:16:06,993] Trial 463 finished with value: 0.3757565391314363 and parameters: {'algorithm': 'ball_tree', 'k_n_neighbors': 10}. Best is trial 134 with value: 0.3757565391314363.
[I 2022-10-24 00:16:29,474] Trial 464 finished with value: 0.3757565391314363 and parameters: {'algorithm': 'ball_tree', 'k_n_neighbors': 10}. Best is trial 134 with value: 0.3757565391314363.
[I 2022-10-24 00:16:50,773] Trial 465 finished with value: 0.3757565391314363 and parameters: {'algorithm': 'ball_tree', 'k_n_neighbors': 10}. Best is trial 134 with value: 0.3757565391314363.
[I 2022-10-24 00:17:12,586] Trial 466 finished with value: 0.3757565391314363 and parameters: {'algorithm': 'ball_tree', 'k_n_neighbors': 10}. Best is trial 134 with value: 0.3757565391314363.
[I 2022-10-24 00:17:24,254] Trial 467 finished with value: 0.37572195506537703 and parameters: {'algorithm': 'auto', 'k_n_neighbors': 10}. Best is trial 134 with value: 0.3757565391314363.
[I 2022-10-24 00:17:45,267] Trial 468 finished with value: 0.3738958658531738 and parameters: {'algorithm': 'ball_tree', 'k_n_neighbors': 9}. Best is trial 134 with value: 0.3757565391314363.
[I 2022-10-24 00:18:06,488] Trial 469 finished with value: 0.3738958658531738 and parameters: {'algorithm': 'ball_tree', 'k_n_neighbors': 9}. Best is trial 134 with value: 0.3757565391314363.
[I 2022-10-24 00:18:27,839] Trial 470 finished with value: 0.3757565391314363 and parameters: {'algorithm': 'ball_tree', 'k_n_neighbors': 10}. Best is trial 134 with value: 0.3757565391314363.
[I 2022-10-24 00:18:48,971] Trial 471 finished with value: 0.3757565391314363 and parameters: {'algorithm': 'ball_tree', 'k_n_neighbors': 10}. Best is trial 134 with value: 0.3757565391314363.
[I 2022-10-24 00:19:10,113] Trial 472 finished with value: 0.3757565391314363 and parameters: {'algorithm': 'ball_tree', 'k_n_neighbors': 10}. Best is trial 134 with value: 0.3757565391314363.
[I 2022-10-24 00:19:28,992] Trial 473 finished with value: 0.3400197775842936 and parameters: {'algorithm': 'ball_tree', 'k_n_neighbors': 3}. Best is trial 134 with value: 0.3757565391314363.
[I 2022-10-24 00:19:49,979] Trial 474 finished with value: 0.3738958658531738 and parameters: {'algorithm': 'ball_tree', 'k_n_neighbors': 9}. Best is trial 134 with value: 0.3757565391314363.
[I 2022-10-24 00:20:11,266] Trial 475 finished with value: 0.3757565391314363 and parameters: {'algorithm': 'ball_tree', 'k_n_neighbors': 10}. Best is trial 134 with value: 0.3757565391314363.
[I 2022-10-24 00:20:32,661] Trial 476 finished with value: 0.3757565391314363 and parameters: {'algorithm': 'ball_tree', 'k_n_neighbors': 10}. Best is trial 134 with value: 0.3757565391314363.
[I 2022-10-24 00:20:53,661] Trial 477 finished with value: 0.3738958658531738 and parameters: {'algorithm': 'ball_tree', 'k_n_neighbors': 9}. Best is trial 134 with value: 0.3757565391314363.
[I 2022-10-24 00:21:15,560] Trial 478 finished with value: 0.3757565391314363 and parameters: {'algorithm': 'ball_tree', 'k_n_neighbors': 10}. Best is trial 134 with value: 0.3757565391314363.
[I 2022-10-24 00:21:37,004] Trial 479 finished with value: 0.3757565391314363 and parameters: {'algorithm': 'ball_tree', 'k_n_neighbors': 10}. Best is trial 134 with value: 0.3757565391314363.
[I 2022-10-24 00:21:58,329] Trial 480 finished with value: 0.3757565391314363 and parameters: {'algorithm': 'ball_tree', 'k_n_neighbors': 10}. Best is trial 134 with value: 0.3757565391314363.
[I 2022-10-24 00:22:19,814] Trial 481 finished with value: 0.3757565391314363 and parameters: {'algorithm': 'ball_tree', 'k_n_neighbors': 10}. Best is trial 134 with value: 0.3757565391314363.
[I 2022-10-24 00:22:41,470] Trial 482 finished with value: 0.3757565391314363 and parameters: {'algorithm': 'ball_tree', 'k_n_neighbors': 10}. Best is trial 134 with value: 0.3757565391314363.
[I 2022-10-24 00:23:02,897] Trial 483 finished with value: 0.3738958658531738 and parameters: {'algorithm': 'ball_tree', 'k_n_neighbors': 9}. Best is trial 134 with value: 0.3757565391314363.
[I 2022-10-24 00:23:22,732] Trial 484 finished with value: 0.3570978929605617 and parameters: {'algorithm': 'ball_tree', 'k_n_neighbors': 5}. Best is trial 134 with value: 0.3757565391314363.
[I 2022-10-24 00:23:44,463] Trial 485 finished with value: 0.3757565391314363 and parameters: {'algorithm': 'ball_tree', 'k_n_neighbors': 10}. Best is trial 134 with value: 0.3757565391314363.
[I 2022-10-24 00:24:05,946] Trial 486 finished with value: 0.3757565391314363 and parameters: {'algorithm': 'ball_tree', 'k_n_neighbors': 10}. Best is trial 134 with value: 0.3757565391314363.
[I 2022-10-24 00:24:28,559] Trial 487 finished with value: 0.3757565391314363 and parameters: {'algorithm': 'ball_tree', 'k_n_neighbors': 10}. Best is trial 134 with value: 0.3757565391314363.
[I 2022-10-24 00:25:07,489] Trial 488 finished with value: 0.375718496832209 and parameters: {'algorithm': 'brute', 'k_n_neighbors': 10}. Best is trial 134 with value: 0.3757565391314363.
[I 2022-10-24 00:25:28,628] Trial 489 finished with value: 0.3738958658531738 and parameters: {'algorithm': 'ball_tree', 'k_n_neighbors': 9}. Best is trial 134 with value: 0.3757565391314363.
[I 2022-10-24 00:25:40,120] Trial 490 finished with value: 0.3395355882197751 and parameters: {'algorithm': 'auto', 'k_n_neighbors': 2}. Best is trial 134 with value: 0.3757565391314363.
[I 2022-10-24 00:26:01,774] Trial 491 finished with value: 0.3757565391314363 and parameters: {'algorithm': 'ball_tree', 'k_n_neighbors': 10}. Best is trial 134 with value: 0.3757565391314363.
[I 2022-10-24 00:26:22,804] Trial 492 finished with value: 0.3757565391314363 and parameters: {'algorithm': 'ball_tree', 'k_n_neighbors': 10}. Best is trial 134 with value: 0.3757565391314363.
[I 2022-10-24 00:26:43,204] Trial 493 finished with value: 0.3710391400861132 and parameters: {'algorithm': 'ball_tree', 'k_n_neighbors': 8}. Best is trial 134 with value: 0.3757565391314363.
[I 2022-10-24 00:27:04,169] Trial 494 finished with value: 0.3738958658531738 and parameters: {'algorithm': 'ball_tree', 'k_n_neighbors': 9}. Best is trial 134 with value: 0.3757565391314363.
[I 2022-10-24 00:27:25,166] Trial 495 finished with value: 0.3757565391314363 and parameters: {'algorithm': 'ball_tree', 'k_n_neighbors': 10}. Best is trial 134 with value: 0.3757565391314363.
[I 2022-10-24 00:27:46,284] Trial 496 finished with value: 0.3757565391314363 and parameters: {'algorithm': 'ball_tree', 'k_n_neighbors': 10}. Best is trial 134 with value: 0.3757565391314363.
[I 2022-10-24 00:28:07,267] Trial 497 finished with value: 0.3738958658531738 and parameters: {'algorithm': 'ball_tree', 'k_n_neighbors': 9}. Best is trial 134 with value: 0.3757565391314363.
[I 2022-10-24 00:28:28,335] Trial 498 finished with value: 0.3757565391314363 and parameters: {'algorithm': 'ball_tree', 'k_n_neighbors': 10}. Best is trial 134 with value: 0.3757565391314363.
[I 2022-10-24 00:28:49,338] Trial 499 finished with value: 0.3757565391314363 and parameters: {'algorithm': 'ball_tree', 'k_n_neighbors': 10}. Best is trial 134 with value: 0.3757565391314363.
[I 2022-10-24 00:29:10,684] Trial 500 finished with value: 0.3757565391314363 and parameters: {'algorithm': 'ball_tree', 'k_n_neighbors': 10}. Best is trial 134 with value: 0.3757565391314363.
[I 2022-10-24 00:29:31,512] Trial 501 finished with value: 0.3738958658531738 and parameters: {'algorithm': 'ball_tree', 'k_n_neighbors': 9}. Best is trial 134 with value: 0.3757565391314363.
[I 2022-10-24 00:29:50,747] Trial 502 finished with value: 0.34783600682734556 and parameters: {'algorithm': 'ball_tree', 'k_n_neighbors': 4}. Best is trial 134 with value: 0.3757565391314363.
[I 2022-10-24 00:30:13,576] Trial 503 finished with value: 0.3757565391314363 and parameters: {'algorithm': 'ball_tree', 'k_n_neighbors': 10}. Best is trial 134 with value: 0.3757565391314363.
[I 2022-10-24 00:30:37,436] Trial 504 finished with value: 0.3757565391314363 and parameters: {'algorithm': 'ball_tree', 'k_n_neighbors': 10}. Best is trial 134 with value: 0.3757565391314363.
[I 2022-10-24 00:31:09,076] Trial 505 finished with value: 0.3757565391314363 and parameters: {'algorithm': 'ball_tree', 'k_n_neighbors': 10}. Best is trial 134 with value: 0.3757565391314363.
[I 2022-10-24 00:31:32,090] Trial 506 finished with value: 0.3757565391314363 and parameters: {'algorithm': 'ball_tree', 'k_n_neighbors': 10}. Best is trial 134 with value: 0.3757565391314363.
[I 2022-10-24 00:31:54,867] Trial 507 finished with value: 0.3757565391314363 and parameters: {'algorithm': 'ball_tree', 'k_n_neighbors': 10}. Best is trial 134 with value: 0.3757565391314363.
[I 2022-10-24 00:32:18,086] Trial 508 finished with value: 0.3757565391314363 and parameters: {'algorithm': 'ball_tree', 'k_n_neighbors': 10}. Best is trial 134 with value: 0.3757565391314363.
[I 2022-10-24 00:32:40,765] Trial 509 finished with value: 0.3738958658531738 and parameters: {'algorithm': 'ball_tree', 'k_n_neighbors': 9}. Best is trial 134 with value: 0.3757565391314363.
[I 2022-10-24 00:33:03,373] Trial 510 finished with value: 0.3757565391314363 and parameters: {'algorithm': 'ball_tree', 'k_n_neighbors': 10}. Best is trial 134 with value: 0.3757565391314363.
[I 2022-10-24 00:33:26,103] Trial 511 finished with value: 0.3757565391314363 and parameters: {'algorithm': 'ball_tree', 'k_n_neighbors': 10}. Best is trial 134 with value: 0.3757565391314363.
[I 2022-10-24 00:34:03,907] Trial 512 finished with value: 0.3738370721813343 and parameters: {'algorithm': 'brute', 'k_n_neighbors': 9}. Best is trial 134 with value: 0.3757565391314363.
[I 2022-10-24 00:34:26,745] Trial 513 finished with value: 0.3757565391314363 and parameters: {'algorithm': 'ball_tree', 'k_n_neighbors': 10}. Best is trial 134 with value: 0.3757565391314363.
[I 2022-10-24 00:34:39,241] Trial 514 finished with value: 0.37572195506537703 and parameters: {'algorithm': 'auto', 'k_n_neighbors': 10}. Best is trial 134 with value: 0.3757565391314363.
[I 2022-10-24 00:35:02,006] Trial 515 finished with value: 0.3738958658531738 and parameters: {'algorithm': 'ball_tree', 'k_n_neighbors': 9}. Best is trial 134 with value: 0.3757565391314363.
[I 2022-10-24 00:35:24,854] Trial 516 finished with value: 0.3757565391314363 and parameters: {'algorithm': 'ball_tree', 'k_n_neighbors': 10}. Best is trial 134 with value: 0.3757565391314363.
[I 2022-10-24 00:35:47,754] Trial 517 finished with value: 0.3757565391314363 and parameters: {'algorithm': 'ball_tree', 'k_n_neighbors': 10}. Best is trial 134 with value: 0.3757565391314363.
[I 2022-10-24 00:36:10,051] Trial 518 finished with value: 0.3757565391314363 and parameters: {'algorithm': 'ball_tree', 'k_n_neighbors': 10}. Best is trial 134 with value: 0.3757565391314363.
[I 2022-10-24 00:36:30,784] Trial 519 finished with value: 0.3757565391314363 and parameters: {'algorithm': 'ball_tree', 'k_n_neighbors': 10}. Best is trial 134 with value: 0.3757565391314363.
[I 2022-10-24 00:36:51,772] Trial 520 finished with value: 0.3757565391314363 and parameters: {'algorithm': 'ball_tree', 'k_n_neighbors': 10}. Best is trial 134 with value: 0.3757565391314363.
[I 2022-10-24 00:37:12,346] Trial 521 finished with value: 0.3738958658531738 and parameters: {'algorithm': 'ball_tree', 'k_n_neighbors': 9}. Best is trial 134 with value: 0.3757565391314363.
[I 2022-10-24 00:37:32,638] Trial 522 finished with value: 0.3738958658531738 and parameters: {'algorithm': 'ball_tree', 'k_n_neighbors': 9}. Best is trial 134 with value: 0.3757565391314363.
[I 2022-10-24 00:37:53,497] Trial 523 finished with value: 0.3757565391314363 and parameters: {'algorithm': 'ball_tree', 'k_n_neighbors': 10}. Best is trial 134 with value: 0.3757565391314363.
[I 2022-10-24 00:38:14,614] Trial 524 finished with value: 0.3757565391314363 and parameters: {'algorithm': 'ball_tree', 'k_n_neighbors': 10}. Best is trial 134 with value: 0.3757565391314363.
[I 2022-10-24 00:38:35,466] Trial 525 finished with value: 0.3757565391314363 and parameters: {'algorithm': 'ball_tree', 'k_n_neighbors': 10}. Best is trial 134 with value: 0.3757565391314363.
[I 2022-10-24 00:38:47,071] Trial 526 finished with value: 0.37572195506537703 and parameters: {'algorithm': 'kd_tree', 'k_n_neighbors': 10}. Best is trial 134 with value: 0.3757565391314363.
[I 2022-10-24 00:39:07,898] Trial 527 finished with value: 0.3738958658531738 and parameters: {'algorithm': 'ball_tree', 'k_n_neighbors': 9}. Best is trial 134 with value: 0.3757565391314363.
[I 2022-10-24 00:39:28,627] Trial 528 finished with value: 0.3757565391314363 and parameters: {'algorithm': 'ball_tree', 'k_n_neighbors': 10}. Best is trial 134 with value: 0.3757565391314363.
[I 2022-10-24 00:39:49,467] Trial 529 finished with value: 0.3757565391314363 and parameters: {'algorithm': 'ball_tree', 'k_n_neighbors': 10}. Best is trial 134 with value: 0.3757565391314363.
[I 2022-10-24 00:40:11,518] Trial 530 finished with value: 0.3757565391314363 and parameters: {'algorithm': 'ball_tree', 'k_n_neighbors': 10}. Best is trial 134 with value: 0.3757565391314363.
[I 2022-10-24 00:40:34,248] Trial 531 finished with value: 0.3757565391314363 and parameters: {'algorithm': 'ball_tree', 'k_n_neighbors': 10}. Best is trial 134 with value: 0.3757565391314363.
[I 2022-10-24 00:40:56,612] Trial 532 finished with value: 0.3738958658531738 and parameters: {'algorithm': 'ball_tree', 'k_n_neighbors': 9}. Best is trial 134 with value: 0.3757565391314363.
[I 2022-10-24 00:41:19,567] Trial 533 finished with value: 0.3757565391314363 and parameters: {'algorithm': 'ball_tree', 'k_n_neighbors': 10}. Best is trial 134 with value: 0.3757565391314363.
[I 2022-10-24 00:41:42,017] Trial 534 finished with value: 0.3738958658531738 and parameters: {'algorithm': 'ball_tree', 'k_n_neighbors': 9}. Best is trial 134 with value: 0.3757565391314363.
[I 2022-10-24 00:42:19,446] Trial 535 finished with value: 0.375718496832209 and parameters: {'algorithm': 'brute', 'k_n_neighbors': 10}. Best is trial 134 with value: 0.3757565391314363.
[I 2022-10-24 00:42:42,545] Trial 536 finished with value: 0.3757565391314363 and parameters: {'algorithm': 'ball_tree', 'k_n_neighbors': 10}. Best is trial 134 with value: 0.3757565391314363.
[I 2022-10-24 00:43:05,344] Trial 537 finished with value: 0.3757565391314363 and parameters: {'algorithm': 'ball_tree', 'k_n_neighbors': 10}. Best is trial 134 with value: 0.3757565391314363.
[I 2022-10-24 00:43:17,415] Trial 538 finished with value: 0.3682031574384106 and parameters: {'algorithm': 'auto', 'k_n_neighbors': 7}. Best is trial 134 with value: 0.3757565391314363.
[I 2022-10-24 00:43:40,010] Trial 539 finished with value: 0.3738958658531738 and parameters: {'algorithm': 'ball_tree', 'k_n_neighbors': 9}. Best is trial 134 with value: 0.3757565391314363.
[I 2022-10-24 00:44:02,780] Trial 540 finished with value: 0.3757565391314363 and parameters: {'algorithm': 'ball_tree', 'k_n_neighbors': 10}. Best is trial 134 with value: 0.3757565391314363.
[I 2022-10-24 00:44:25,376] Trial 541 finished with value: 0.3757565391314363 and parameters: {'algorithm': 'ball_tree', 'k_n_neighbors': 10}. Best is trial 134 with value: 0.3757565391314363.
[I 2022-10-24 00:44:48,472] Trial 542 finished with value: 0.3757565391314363 and parameters: {'algorithm': 'ball_tree', 'k_n_neighbors': 10}. Best is trial 134 with value: 0.3757565391314363.
[I 2022-10-24 00:45:11,144] Trial 543 finished with value: 0.3738958658531738 and parameters: {'algorithm': 'ball_tree', 'k_n_neighbors': 9}. Best is trial 134 with value: 0.3757565391314363.
[I 2022-10-24 00:45:34,125] Trial 544 finished with value: 0.3757565391314363 and parameters: {'algorithm': 'ball_tree', 'k_n_neighbors': 10}. Best is trial 134 with value: 0.3757565391314363.
[I 2022-10-24 00:45:57,131] Trial 545 finished with value: 0.3757565391314363 and parameters: {'algorithm': 'ball_tree', 'k_n_neighbors': 10}. Best is trial 134 with value: 0.3757565391314363.
[I 2022-10-24 00:46:20,046] Trial 546 finished with value: 0.3757565391314363 and parameters: {'algorithm': 'ball_tree', 'k_n_neighbors': 10}. Best is trial 134 with value: 0.3757565391314363.
[I 2022-10-24 00:46:42,897] Trial 547 finished with value: 0.3757565391314363 and parameters: {'algorithm': 'ball_tree', 'k_n_neighbors': 10}. Best is trial 134 with value: 0.3757565391314363.
[I 2022-10-24 00:47:05,644] Trial 548 finished with value: 0.3738958658531738 and parameters: {'algorithm': 'ball_tree', 'k_n_neighbors': 9}. Best is trial 134 with value: 0.3757565391314363.
[I 2022-10-24 00:47:28,670] Trial 549 finished with value: 0.3757565391314363 and parameters: {'algorithm': 'ball_tree', 'k_n_neighbors': 10}. Best is trial 134 with value: 0.3757565391314363.
[I 2022-10-24 00:47:41,232] Trial 550 finished with value: 0.37572195506537703 and parameters: {'algorithm': 'kd_tree', 'k_n_neighbors': 10}. Best is trial 134 with value: 0.3757565391314363.
[I 2022-10-24 00:48:04,035] Trial 551 finished with value: 0.3738958658531738 and parameters: {'algorithm': 'ball_tree', 'k_n_neighbors': 9}. Best is trial 134 with value: 0.3757565391314363.
[I 2022-10-24 00:48:26,997] Trial 552 finished with value: 0.3757565391314363 and parameters: {'algorithm': 'ball_tree', 'k_n_neighbors': 10}. Best is trial 134 with value: 0.3757565391314363.
[I 2022-10-24 00:48:49,772] Trial 553 finished with value: 0.3757565391314363 and parameters: {'algorithm': 'ball_tree', 'k_n_neighbors': 10}. Best is trial 134 with value: 0.3757565391314363.
[I 2022-10-24 00:49:12,851] Trial 554 finished with value: 0.3757565391314363 and parameters: {'algorithm': 'ball_tree', 'k_n_neighbors': 10}. Best is trial 134 with value: 0.3757565391314363.
[I 2022-10-24 00:49:35,497] Trial 555 finished with value: 0.3757565391314363 and parameters: {'algorithm': 'ball_tree', 'k_n_neighbors': 10}. Best is trial 134 with value: 0.3757565391314363.
[I 2022-10-24 00:49:58,015] Trial 556 finished with value: 0.3738958658531738 and parameters: {'algorithm': 'ball_tree', 'k_n_neighbors': 9}. Best is trial 134 with value: 0.3757565391314363.
[I 2022-10-24 00:50:21,209] Trial 557 finished with value: 0.3757565391314363 and parameters: {'algorithm': 'ball_tree', 'k_n_neighbors': 10}. Best is trial 134 with value: 0.3757565391314363.
[I 2022-10-24 00:50:42,961] Trial 558 finished with value: 0.3757565391314363 and parameters: {'algorithm': 'ball_tree', 'k_n_neighbors': 10}. Best is trial 134 with value: 0.3757565391314363.
[I 2022-10-24 00:51:21,265] Trial 559 finished with value: 0.3738370721813343 and parameters: {'algorithm': 'brute', 'k_n_neighbors': 9}. Best is trial 134 with value: 0.3757565391314363.
[I 2022-10-24 00:51:44,821] Trial 560 finished with value: 0.3757565391314363 and parameters: {'algorithm': 'ball_tree', 'k_n_neighbors': 10}. Best is trial 134 with value: 0.3757565391314363.
[I 2022-10-24 00:52:07,863] Trial 561 finished with value: 0.3757565391314363 and parameters: {'algorithm': 'ball_tree', 'k_n_neighbors': 10}. Best is trial 134 with value: 0.3757565391314363.
[I 2022-10-24 00:52:31,055] Trial 562 finished with value: 0.3757565391314363 and parameters: {'algorithm': 'ball_tree', 'k_n_neighbors': 10}. Best is trial 134 with value: 0.3757565391314363.
[I 2022-10-24 00:52:43,386] Trial 563 finished with value: 0.37572195506537703 and parameters: {'algorithm': 'auto', 'k_n_neighbors': 10}. Best is trial 134 with value: 0.3757565391314363.
[I 2022-10-24 00:53:06,086] Trial 564 finished with value: 0.3757565391314363 and parameters: {'algorithm': 'ball_tree', 'k_n_neighbors': 10}. Best is trial 134 with value: 0.3757565391314363.
[I 2022-10-24 00:53:29,081] Trial 565 finished with value: 0.3738958658531738 and parameters: {'algorithm': 'ball_tree', 'k_n_neighbors': 9}. Best is trial 134 with value: 0.3757565391314363.
[I 2022-10-24 00:53:51,857] Trial 566 finished with value: 0.3757565391314363 and parameters: {'algorithm': 'ball_tree', 'k_n_neighbors': 10}. Best is trial 134 with value: 0.3757565391314363.
[I 2022-10-24 00:54:14,342] Trial 567 finished with value: 0.3738958658531738 and parameters: {'algorithm': 'ball_tree', 'k_n_neighbors': 9}. Best is trial 134 with value: 0.3757565391314363.
[I 2022-10-24 00:54:37,376] Trial 568 finished with value: 0.3757565391314363 and parameters: {'algorithm': 'ball_tree', 'k_n_neighbors': 10}. Best is trial 134 with value: 0.3757565391314363.
